transaction_id,account_id,transaction_date,transaction_time,transaction_type,amount,description
1251,579,2021-09-25,11:53:07,Deposit,5465.58,Certain major increase begin language.
1252,354,2022-11-03,05:08:28,Withdrawal,6668.73,Feel give wonder both admit black.
1253,72,2023-09-02,04:04:21,Withdrawal,869.3,Then like blood entire quality wind maybe.
1254,1385,2024-07-29,07:51:24,Withdrawal,2092.63,Money teach part successful service travel.
1255,470,2024-08-25,20:19:58,Withdrawal,9544.04,Win certainly group media.
1256,234,2022-04-15,00:19:47,Transfer,6963.78,Range baby man right official information inside.
1257,961,2022-09-21,08:31:42,Withdrawal,8987.02,Firm ball rock religious.
1258,890,2023-10-14,04:07:16,Withdrawal,5986.74,Onto at career.
1259,823,2021-09-28,19:35:59,Deposit,903.2,Firm probably goal parent something reflect with.
1260,155,2024-02-06,21:17:02,Transfer,533.63,Physical direction soon instead suffer film without job.
1261,2412,2023-12-28,16:55:31,Deposit,669.01,Kind agree energy card dark probably magazine.
1262,467,2022-09-26,04:26:03,Transfer,45.48,Also understand authority score security.
1263,2178,2021-08-31,10:07:39,Deposit,1743.17,Husband else more technology film its political.
1264,945,2023-09-22,03:20:44,Withdrawal,6993.21,Director remain husband hotel.
1265,1373,2020-11-01,22:41:48,Transfer,8809.0,Party team century field.
1266,737,2021-06-17,04:26:33,Transfer,6832.6,That according option away employee minute.
1267,943,2023-11-18,00:18:46,Deposit,9235.39,Around investment full order.
1268,1817,2023-07-24,17:39:38,Withdrawal,4252.73,Which political study.
1269,1711,2021-09-17,21:28:21,Withdrawal,1712.23,Woman little against young.
1270,102,2022-12-17,13:36:33,Transfer,7890.81,Western result act citizen.
1271,562,2025-03-23,18:22:22,Transfer,6355.54,Want two exist argue too might.
1272,1429,2024-04-21,23:33:23,Transfer,3037.97,Organization worker response moment summer approach.
1273,1051,2021-09-08,06:49:26,Withdrawal,8469.57,Likely society amount.
1274,903,2023-04-02,02:49:37,Deposit,9935.15,Among against late figure head.
1275,362,2023-09-26,13:22:44,Deposit,9794.99,Fish capital rise plan many event between sense.
1276,869,2023-08-09,13:06:36,Transfer,7799.75,Forward will else official personal tend occur.
1277,1773,2021-04-10,10:31:18,Withdrawal,9299.39,Something now financial summer respond article executive.
1278,2064,2022-02-14,23:28:10,Withdrawal,9787.53,Fact follow opportunity avoid walk international.
1279,2395,2020-11-20,14:17:09,Deposit,7472.49,Remain charge race win.
1280,1730,2024-01-19,22:02:00,Transfer,2335.48,Peace information care director everyone response second three.
1281,1459,2025-01-29,16:08:06,Transfer,297.53,Support mission say Mr.
1282,1662,2023-10-09,01:41:37,Withdrawal,4277.14,High federal party prevent whom trouble reality.
1283,403,2025-06-01,22:26:47,Transfer,4957.44,Mrs seek look worry color community.
1284,514,2024-10-13,20:07:38,Transfer,5312.4,Magazine question environment until sort much.
1285,888,2025-04-06,08:33:26,Withdrawal,9269.1,Dinner owner effect music.
1286,2155,2024-10-10,13:23:43,Transfer,6671.01,Require minute sort discuss.
1287,1625,2023-03-31,06:18:06,Transfer,1623.04,Big contain all design base bar consumer.
1288,705,2021-01-01,07:31:04,Transfer,1597.56,Skill old friend wear Democrat care.
1289,1782,2022-11-29,17:21:48,Withdrawal,5152.09,Tell increase recent what.
1290,46,2020-11-04,12:17:23,Transfer,6995.38,Throw hot site true analysis term party.
1291,1627,2021-10-03,00:16:36,Deposit,9496.53,Former field attorney baby budget capital bed.
1292,1331,2020-09-29,05:26:32,Deposit,1880.74,There technology friend their effect character.
1293,2467,2024-04-02,08:41:00,Transfer,8920.99,Population ask appear true.
1294,2496,2021-08-14,13:28:40,Deposit,4643.36,Line face it wait again we peace.
1295,991,2022-08-09,08:01:30,Withdrawal,5660.35,Choose agree region body science maybe.
1296,1325,2023-08-07,12:21:50,Withdrawal,6228.64,Everybody behind dark certainly short blue.
1297,624,2021-07-18,15:50:38,Withdrawal,3233.93,Back energy mouth watch indeed.
1298,2032,2024-09-30,04:52:16,Withdrawal,2970.89,Part happen TV gas.
1299,770,2025-04-03,08:04:13,Transfer,3699.88,Language start various task get south major statement.
1300,101,2023-05-29,09:09:47,Withdrawal,302.97,Model face television cover.
1301,1192,2021-09-13,00:04:50,Deposit,7734.33,Report tonight because.
1302,1588,2021-04-02,13:30:12,Withdrawal,4833.63,Require other in.
1303,2342,2022-07-21,19:40:10,Deposit,9534.44,Road this PM before him food.
1304,1444,2021-04-30,16:11:04,Withdrawal,3515.68,Data election play.
1305,2183,2025-04-28,23:42:40,Withdrawal,811.99,Buy change across information.
1306,1264,2024-10-26,20:26:56,Transfer,4291.02,Already really many such foreign understand.
1307,1479,2023-07-16,07:40:59,Deposit,53.58,History yes could raise market final.
1308,1073,2023-12-08,16:39:26,Withdrawal,5947.71,As example front member hear stop thank professional.
1309,2142,2020-07-08,22:13:25,Withdrawal,5616.17,Build risk type ahead fine people.
1310,1432,2020-12-23,16:18:38,Transfer,4635.92,Adult Democrat campaign style style share.
1311,955,2021-08-07,07:21:03,Transfer,176.44,Run area best table agent life.
1312,804,2020-09-28,06:36:20,Deposit,1243.68,A we everybody machine lose.
1313,615,2024-01-12,22:27:20,Withdrawal,6339.86,Tv knowledge accept vote bed meet worker.
1314,2078,2021-01-09,19:18:35,Withdrawal,8357.78,Pretty to pass its commercial exist writer.
1315,1128,2023-05-05,02:40:11,Deposit,5720.49,Game place along dark.
1316,1645,2022-03-09,00:52:45,Transfer,6434.85,Behavior southern baby anyone do phone garden.
1317,743,2024-08-24,12:01:15,Deposit,2278.35,Free move present.
1318,2477,2023-01-30,22:40:37,Deposit,8210.19,Each maintain make arrive decade.
1319,65,2025-03-18,02:03:14,Withdrawal,1689.8,Nor teacher read contain human.
1320,2042,2022-03-15,04:28:25,Transfer,1963.7,Present trouble discussion work bag as hair green.
1321,1072,2022-09-30,20:17:30,Deposit,9047.94,Practice government any we.
1322,1735,2022-12-26,13:02:53,Deposit,2603.03,Story ago far seem identify.
1323,1849,2024-01-30,08:39:54,Withdrawal,2399.79,Every cell talk newspaper.
1324,1181,2024-05-04,17:48:22,Deposit,6975.89,Image word successful true easy artist.
1325,377,2021-09-19,15:57:55,Transfer,7628.78,Everything similar before list.
1326,2448,2023-08-03,01:56:00,Withdrawal,9013.9,Investment make both low fact.
1327,2032,2021-10-17,20:07:57,Withdrawal,506.5,Bit car she society.
1328,2020,2025-05-24,06:06:13,Deposit,3625.25,Standard second those information.
1329,1527,2025-05-17,05:31:54,Deposit,2551.32,Always couple pay he beyond behavior something.
1330,1150,2025-04-18,17:33:03,Withdrawal,6556.61,Show minute show create organization beyond.
1331,2198,2022-05-17,15:42:51,Transfer,8228.99,Test her last fine letter return already.
1332,2106,2023-10-28,15:02:34,Deposit,6665.91,Carry including meet hair.
1333,2076,2024-02-27,15:19:22,Deposit,7867.62,Body as people ball enter.
1334,937,2022-02-03,12:18:53,Transfer,9398.39,Find subject arm catch.
1335,2241,2022-10-09,04:15:05,Withdrawal,6303.51,Effort economy choice have cause carry.
1336,2026,2021-02-01,08:25:45,Deposit,4347.42,Window act few back.
1337,1228,2021-05-10,08:27:09,Transfer,3138.77,His part prove main student worker point.
1338,1888,2022-11-21,12:29:59,Withdrawal,3655.54,Minute serious shake school town.
1339,2081,2024-02-25,14:01:35,Transfer,2914.37,Teach recent today than.
1340,1674,2020-09-10,12:11:34,Transfer,5612.92,Newspaper traditional same my last at certain week.
1341,1032,2021-03-13,11:25:33,Withdrawal,2446.11,Position though you while executive.
1342,1764,2020-10-24,05:10:43,Transfer,6908.18,Fish reach economic bed.
1343,130,2021-11-01,17:16:28,Withdrawal,247.55,Require individual on control.
1344,1252,2021-10-13,07:45:21,Withdrawal,7999.1,Father final rather public.
1345,131,2020-10-01,18:32:05,Transfer,1756.94,Official decade loss president when once consumer.
1346,1899,2022-01-20,09:46:04,Deposit,7330.84,
1347,1876,2023-03-05,00:32:14,Deposit,2810.84,Little fast Congress policy serve as explain.
1348,2472,2022-08-19,15:40:11,Deposit,5675.77,Business grow expert pull care always.
1349,1831,2023-05-18,09:13:34,Deposit,9147.64,Wear throw glass matter world operation safe.
1350,582,2024-12-17,18:25:00,Transfer,3154.18,Detail environmental learn usually.
1351,1415,2022-10-14,23:24:43,Transfer,6292.57,Officer size why free region serve spring buy.
1352,990,2021-01-21,08:54:16,Transfer,9254.51,Source star certain.
1353,565,2021-02-26,19:22:19,Withdrawal,5595.36,Talk show big truth.
1354,1452,2024-04-22,16:46:27,Deposit,6769.07,Ground before so lay.
1355,20,2021-04-23,11:35:41,Withdrawal,9924.65,Challenge point over.
1356,758,2022-07-29,13:34:48,Transfer,951.19,Century for southern president.
1357,930,2021-04-09,07:42:39,Deposit,1401.3,Total exist table themselves.
1358,1085,2025-02-08,11:39:25,Transfer,6869.78,Look tonight green mission also situation their.
1359,917,2025-03-10,03:35:00,Withdrawal,6208.2,My herself improve mind.
1360,1355,2021-02-12,09:16:41,Deposit,795.91,Performance weight her certainly then.
1361,412,2022-07-05,14:05:01,Deposit,1430.94,His similar of environment quite.
1362,2360,2024-02-15,06:37:44,Deposit,2754.96,Toward century guy mission model anything top.
1363,1643,2021-09-26,01:37:04,Withdrawal,1854.66,Over impact product people arm lose live.
1364,1083,2023-12-29,13:55:40,Deposit,5518.09,Hair decide can own.
1365,1558,2023-11-26,17:35:30,Deposit,8063.18,Later throughout card smile.
1366,210,2024-08-07,05:57:08,Transfer,3641.14,Career also table expect.
1367,789,2024-07-03,16:33:25,Transfer,7151.97,Memory candidate look quickly mention or difference.
1368,1199,2020-12-30,01:21:14,Withdrawal,9546.05,There measure measure product low event your.
1369,1767,2022-06-10,21:37:31,Deposit,7983.88,Treat wrong identify lay activity country.
1370,332,2024-07-19,04:30:29,Transfer,2329.18,Kind stage view state new.
1371,1953,2020-10-16,00:42:45,Transfer,9019.75,Kitchen business visit understand office range.
1372,1465,2023-08-08,18:48:35,Withdrawal,7560.43,Control yard low certainly.
1373,1859,2021-12-10,20:01:54,Transfer,322.19,Even to science very under detail any charge.
1374,556,2021-08-28,15:03:03,Withdrawal,1872.91,Put how final even take some.
1375,1703,2024-03-15,11:44:28,Withdrawal,2005.97,Full run every may dinner.
1376,1579,2024-11-04,11:58:58,Deposit,9976.9,My state TV.
1377,356,2024-12-01,10:06:41,Transfer,3181.43,Only cover after out.
1378,1734,2022-11-19,02:37:57,Transfer,7221.92,She assume story week great can friend.
1379,684,2022-06-02,05:57:25,Withdrawal,2580.71,Phone shake wall focus.
1380,1738,2023-03-11,11:47:38,Deposit,5141.82,Service court name.
1381,2094,2024-06-03,03:53:57,Transfer,4426.33,Than anything company white listen west which.
1382,2414,2022-08-02,19:31:56,Transfer,9329.76,Study full turn significant.
1383,959,2023-11-24,08:21:01,Deposit,6039.04,Culture term by.
1384,83,2023-05-24,05:28:12,Deposit,9230.24,Let even where his factor rate.
1385,303,2024-12-22,17:10:46,Withdrawal,7449.87,Drop case nature power usually.
1386,1273,2024-03-11,05:31:53,Withdrawal,334.54,According view always opportunity research let.
1387,2418,2021-01-05,05:27:21,Transfer,1436.96,Military purpose hope person ready author wind.
1388,1716,2021-03-05,15:04:30,Withdrawal,2283.36,Though every north large.
1389,710,2022-03-01,22:12:25,Deposit,2811.17,Land hospital space.
1390,2176,2023-10-08,08:37:30,Transfer,5310.62,Mrs help home baby together.
1391,2057,2024-05-02,02:36:39,Withdrawal,8503.59,Commercial lead over people.
1392,1196,2024-06-19,11:26:10,Transfer,1531.01,Surface floor mention particular meeting detail.
1393,2490,2021-01-05,15:01:58,Deposit,4013.37,Lot family beyond western.
1394,593,2021-06-21,21:28:52,Transfer,1765.29,Indicate campaign down deal success purpose.
1395,439,2021-05-24,05:25:59,Deposit,2560.96,Conference another doctor cell star fill man.
1396,1520,2020-12-17,09:13:18,Withdrawal,3792.18,Production budget particularly group beat appear father happen.
1397,2498,2020-10-02,09:13:40,Deposit,1110.89,Cup pass college.
1398,2419,2020-08-18,14:27:09,Deposit,7487.38,Position their table cultural radio step choice.
1399,795,2022-07-09,14:59:41,Deposit,5218.16,Vote day market.
1400,1226,2022-06-14,02:49:19,Deposit,4364.43,At politics skill challenge paper single idea.
1401,922,2021-09-15,02:31:06,Deposit,8867.12,Position major there professional but reason.
1402,643,2022-01-24,14:27:51,Transfer,9813.41,Range without step appear.
1403,487,2022-01-12,15:41:33,Transfer,6428.74,Idea throw bag beautiful toward teach.
1404,1672,2021-04-05,04:34:25,Deposit,6836.37,Year year south space area.
1405,1916,2024-05-13,13:44:06,Transfer,1273.81,Level major wall collection.
1406,1392,2024-10-27,04:20:21,Deposit,9097.92,Early despite visit either product.
1407,663,2022-03-17,19:08:56,Transfer,1124.31,Security quite might understand.
1408,342,2021-12-21,08:44:30,Transfer,545.22,Rock well little guy.
1409,937,2024-02-18,20:56:59,Transfer,1564.64,Story local character ready think impact.
1410,2253,2023-02-14,12:23:22,Deposit,3976.73,Ask cost trade help.
1411,1320,2021-06-25,14:58:36,Withdrawal,2186.13,Then wonder section hope executive.
1412,1983,2023-05-01,09:42:10,Deposit,7731.03,According raise effort ask.
1413,2314,2021-07-16,00:23:25,Transfer,6827.62,Effect buy best others sport.
1414,1811,2023-04-16,20:58:19,Transfer,2927.25,Able charge seat protect part million doctor.
1415,332,2022-01-06,19:14:08,Withdrawal,8635.25,College save during herself kid.
1416,1123,2020-09-01,03:18:07,Withdrawal,520.67,Nothing have term worry government similar many.
1417,728,2021-06-30,22:01:14,Deposit,1318.01,May take question building hear service.
1418,2133,2023-06-09,11:00:05,Deposit,5609.01,Next peace technology themselves measure.
1419,141,2021-07-04,05:00:00,Deposit,7450.31,Service identify themselves.
1420,1419,2024-11-27,21:40:50,Deposit,1709.31,Show senior attention reflect consider.
1421,1638,2021-01-06,18:35:30,Withdrawal,7614.71,His anyone provide police.
1422,195,2024-01-28,15:30:22,Withdrawal,95.0,Any skin rise since.
1423,843,2023-10-11,06:17:54,Withdrawal,4086.79,Wait team order keep agent.
1424,1426,2022-11-16,16:45:05,Withdrawal,6258.08,Bit sometimes return with receive.
1425,599,2023-01-17,05:29:15,Deposit,7890.19,Hand kid office my key.
1426,395,2024-08-09,08:43:36,Deposit,764.41,Kind floor improve miss real education check.
1427,2251,2022-09-08,11:19:27,Transfer,1330.3,Onto discussion special vote beyond turn.
1428,199,2024-01-14,11:29:40,Withdrawal,1010.29,Pattern reflect population city dark cultural out issue.
1429,1538,2020-08-16,17:47:52,Deposit,1014.49,Mention edge born treat certainly.
1430,610,2024-04-16,10:23:08,Deposit,994.42,Music anything probably star wish.
1431,2241,2022-06-27,14:32:08,Deposit,3623.0,Reason consumer smile better process.
1432,130,2023-05-14,21:48:12,Transfer,7404.92,Past trouble red huge little still pass couple.
1433,315,2023-10-04,15:38:54,Transfer,3873.49,Sing stuff bill much simply hard ten.
1434,1684,2022-08-03,21:20:01,Deposit,4159.21,
1435,2202,2024-05-06,23:17:18,Transfer,6770.6,Director occur treat skill near.
1436,1962,2024-04-08,00:32:54,Deposit,7385.41,Everybody peace western view middle.
1437,1909,2024-02-29,11:20:39,Transfer,5107.7,Fund near organization article worker resource role.
1438,1992,2021-10-01,08:54:33,Withdrawal,4826.61,War pick always whether.
1439,95,2023-08-03,09:56:53,Withdrawal,1302.72,Lay prepare speech alone tax another fly.
1440,409,2022-06-15,04:54:19,Deposit,9665.57,Special result other network it determine tree.
1441,1871,2022-07-21,04:51:22,Deposit,4342.68,All much major later.
1442,1496,2021-02-17,01:40:26,Deposit,7946.61,Especially present edge baby attorney determine able.
1443,2485,2021-05-17,05:02:23,Withdrawal,1050.95,Rise source cover history condition win important.
1444,27,2021-09-30,20:05:39,Transfer,3719.43,Else threat lawyer activity.
1445,2393,2025-04-12,20:09:29,Deposit,6225.94,Like half law it do choice.
1446,1245,2023-06-29,21:07:28,Withdrawal,2602.82,Put purpose hair reality know fund.
1447,2481,2024-03-27,21:53:17,Withdrawal,1426.26,But class system account thank information fly.
1448,1387,2023-02-25,08:23:54,Withdrawal,8228.8,Any professional after sometimes everything.
1449,1858,2022-03-12,06:47:19,Withdrawal,4990.18,Citizen product teach little tough paper Democrat.
1450,1828,2023-06-15,15:34:09,Transfer,6846.71,Experience crime federal never.
1451,2053,2021-07-24,21:16:22,Transfer,4158.58,Name actually season artist.
1452,1744,2023-10-31,18:36:18,Deposit,5850.7,Modern away source business issue special special.
1453,551,2025-01-30,04:58:20,Transfer,4023.23,Rate successful rock shoulder course physical wait material.
1454,1805,2021-02-13,16:00:42,Transfer,2195.4,Expect speak serious enjoy artist happy there.
1455,1489,2024-05-28,08:24:47,Withdrawal,2082.66,Edge party which.
1456,2231,2021-03-31,16:58:35,Transfer,4783.5,Specific natural leave candidate science.
1457,191,2023-03-28,19:40:14,Deposit,7297.09,Trouble appear increase cell subject fight ago.
1458,1183,2023-07-22,18:45:30,Transfer,3814.0,Set see protect want need past doctor.
1459,1218,2022-02-17,13:26:31,Withdrawal,8858.61,Quickly main protect discover seat arrive strategy.
1460,1738,2025-02-18,12:51:00,Deposit,7277.94,
1461,453,2025-06-11,12:34:08,Deposit,8057.3,Real notice mean executive military activity war free.
1462,397,2023-06-09,14:11:24,Transfer,2988.92,Maintain idea card year consumer current.
1463,419,2020-10-10,19:45:56,Withdrawal,1863.83,Hot leg everyone model art.
1464,462,2021-08-27,23:29:41,Transfer,3973.85,And even property today participant page per tough.
1465,1727,2022-10-04,17:56:42,Deposit,8872.88,Democrat player lay sign occur dream.
1466,1963,2020-08-14,12:14:12,Deposit,8418.77,Six box style current law team trouble.
1467,1545,2021-05-19,16:23:59,Transfer,9769.8,Say organization life skill.
1468,2092,2024-05-01,06:19:23,Withdrawal,9270.46,Describe after appear community sea within week.
1469,2258,2021-11-15,05:35:42,Transfer,7796.3,Happen minute author nor eat campaign.
1470,116,2021-02-02,00:58:19,Withdrawal,5417.42,Station medical interview political second.
1471,2472,2025-03-06,19:28:50,Transfer,2286.1,Tend thing address some bag send.
1472,323,2023-03-13,06:49:42,Withdrawal,5770.76,Shoulder become in future.
1473,594,2024-10-11,17:25:53,Transfer,9878.43,Go somebody rise note meet.
1474,687,2021-02-02,13:06:52,Withdrawal,9351.07,Will glass role.
1475,2451,2023-02-02,05:15:33,Deposit,2808.79,Develop market experience consumer statement stay.
1476,1083,2022-04-07,22:51:21,Deposit,3777.43,At anyone rise on smile discussion government.
1477,595,2023-07-03,18:04:32,Transfer,950.94,Operation ago light property hold.
1478,698,2023-01-06,14:31:02,Deposit,5140.49,Suffer rule past car road order.
1479,509,2021-02-14,02:45:52,Transfer,1933.87,Successful president too lose fish the laugh.
1480,468,2024-07-22,23:32:33,Withdrawal,6968.27,Room treat current seven.
1481,1641,2024-12-13,04:47:18,Transfer,543.75,Various life herself as.
1482,1371,2025-02-15,14:52:30,Transfer,4487.51,Moment skill medical ahead grow fear.
1483,2133,2023-03-10,06:03:25,Transfer,2527.92,Finish vote movement hand concern.
1484,1167,2021-06-13,20:43:04,Transfer,6146.86,Thing prepare picture list society.
1485,233,2021-03-28,16:38:18,Withdrawal,1620.69,Father art leader notice painting.
1486,437,2023-01-13,17:06:16,Withdrawal,1251.15,Think commercial magazine when.
1487,1677,2021-03-05,05:20:00,Withdrawal,9878.57,Question figure go.
1488,389,2020-10-20,05:52:48,Transfer,6201.91,Shake door conference watch according interest.
1489,39,2023-11-27,08:50:38,Withdrawal,778.93,Prepare country anyone career against eye.
1490,1284,2021-09-20,18:46:13,Withdrawal,8617.09,Too act choose visit yes may first.
1491,1671,2021-02-05,01:49:42,Deposit,8292.61,Lot fast after past cell apply.
1492,1889,2020-08-24,16:29:34,Withdrawal,8329.7,Thus ready quite thought follow assume.
1493,730,2025-04-21,22:37:42,Transfer,8668.67,Himself father product fill.
1494,1715,2021-04-20,13:00:36,Transfer,3057.83,Open school unit agree.
1495,1999,2024-08-15,03:52:16,Transfer,5076.09,Truth degree grow box reduce who.
1496,866,2024-06-16,16:26:23,Transfer,8530.93,Carry minute organization lead officer pattern.
1497,2379,2022-08-05,04:46:36,Transfer,544.98,Company edge admit enter I.
1498,683,2020-07-14,04:52:42,Transfer,483.14,Goal believe local everyone suffer allow popular.
1499,54,2024-01-07,14:01:57,Withdrawal,777.83,But leader into find add wrong scene.
1500,1426,2025-03-23,02:17:57,Deposit,7955.49,Compare affect not which.
1501,471,2024-12-19,13:31:13,Withdrawal,2225.82,Reduce leave arm film.
1502,797,2023-11-30,05:56:40,Withdrawal,9210.02,Forward them eye also music may this culture.
1503,992,2024-08-19,03:18:25,Deposit,4707.36,True of agree television.
1504,1350,2025-03-08,20:25:07,Withdrawal,5788.17,Mind fear car.
1505,186,2023-12-05,20:23:07,Withdrawal,6895.58,Information argue sit material system.
1506,994,2023-01-20,20:22:07,Withdrawal,6728.83,Collection hand hospital smile.
1507,1212,2022-12-25,19:19:54,Withdrawal,5163.73,Thing main sure central go state medical garden.
1508,922,2022-11-09,16:23:44,Withdrawal,6951.5,Trip region smile parent green.
1509,961,2023-03-24,18:20:01,Transfer,5981.04,Government down success director all travel reason.
1510,507,2022-08-10,11:15:28,Deposit,4823.47,Society spring young likely student.
1511,893,2022-08-06,02:05:28,Transfer,6324.85,Number notice real able.
1512,1320,2021-08-15,04:29:05,Withdrawal,1067.36,Sign dog seat throughout.
1513,286,2020-07-12,11:21:41,Transfer,7008.63,Choose spring really moment wind.
1514,2285,2024-06-28,02:04:52,Deposit,6297.21,Question yet say air.
1515,1041,2023-06-15,11:08:26,Withdrawal,8677.79,Interest set air student.
1516,436,2022-11-26,06:38:35,Transfer,9914.66,Special history on.
1517,1663,2024-09-04,17:24:50,Deposit,1223.93,Front throw drug hotel professor machine day.
1518,956,2023-11-21,07:35:37,Transfer,5986.36,Certainly kind free writer take.
1519,401,2024-06-20,00:48:34,Deposit,7236.05,Method professor affect rich.
1520,1304,2022-05-12,15:00:45,Deposit,947.22,Bed whole far strategy scene never apply well.
1521,216,2025-01-04,04:00:56,Transfer,2431.19,Third ok bar approach these billion listen five.
1522,1927,2021-07-28,06:35:31,Transfer,4005.43,Sign point many act agency upon true.
1523,1384,2021-12-07,13:58:14,Transfer,470.95,Despite hit civil her voice.
1524,1253,2021-01-16,23:32:46,Withdrawal,8820.47,Call likely anyone watch organization question audience difference.
1525,1904,2024-02-04,06:53:30,Deposit,6300.08,Old source it force away.
1526,132,2024-12-12,22:42:25,Transfer,9852.86,Majority operation develop over away trial my whether.
1527,721,2022-10-08,09:05:38,Transfer,1085.04,Serious send expert magazine age determine.
1528,771,2025-03-08,11:31:00,Withdrawal,6512.0,Best staff low over training someone show.
1529,381,2022-01-05,15:49:26,Withdrawal,4010.6,Moment dark three eat.
1530,845,2021-09-14,03:40:21,Deposit,9630.28,Realize service husband.
1531,1757,2020-11-19,03:02:59,Withdrawal,297.54,Coach trip stand owner business mouth half.
1532,496,2024-09-19,05:32:36,Withdrawal,6572.05,Community reflect big minute center develop.
1533,46,2023-07-04,16:24:31,Transfer,9199.62,Ok walk Mr example card.
1534,704,2022-03-12,07:53:32,Transfer,1715.65,One operation wear cut effect.
1535,1108,2023-09-29,03:13:52,Deposit,6886.57,Simple important theory film federal decision economy trade.
1536,941,2023-08-12,07:36:14,Deposit,4123.83,Pretty western morning hope audience different.
1537,758,2024-04-25,09:31:09,Transfer,2354.54,Necessary write first sense.
1538,60,2023-11-24,21:25:40,Deposit,8916.69,Yourself smile crime full read travel story.
1539,1270,2020-08-28,20:17:25,Withdrawal,2691.87,Leader against you food.
1540,2265,2020-10-11,10:49:40,Withdrawal,1561.46,Field care cut end include fall.
1541,127,2021-10-09,10:38:14,Deposit,6934.34,Actually land group maintain.
1542,1507,2024-02-14,01:45:35,Deposit,6980.09,Give ball deal direction fast even visit.
1543,1685,2024-03-20,13:40:18,Withdrawal,7018.5,Section discussion relationship notice impact easy.
1544,484,2025-02-18,07:14:18,Transfer,7361.03,Consider west style when.
1545,267,2024-08-28,09:38:13,Withdrawal,4171.12,Loss return wide education education give.
1546,2360,2020-09-19,20:23:34,Withdrawal,1039.47,Coach stop see page program buy get health.
1547,789,2023-05-19,07:53:45,Transfer,5396.13,Pattern cell protect buy.
1548,789,2022-01-26,19:41:08,Withdrawal,398.92,Election nature sign entire.
1549,550,2024-07-21,14:12:14,Withdrawal,8389.32,Despite current door fund role character we night.
1550,229,2021-10-17,13:56:46,Transfer,9093.89,Cut put board trial direction sea.
1551,312,2020-09-30,13:15:30,Transfer,9019.16,Late wind finish feel audience administration too available.
1552,112,2025-05-29,16:17:00,Transfer,2004.34,Management main themselves name company dog.
1553,1095,2023-02-05,20:22:04,Deposit,7496.0,Business free mother executive what set.
1554,719,2022-01-30,20:26:40,Deposit,6345.39,Act mind avoid artist summer.
1555,1968,2021-03-26,08:19:47,Withdrawal,7114.14,Again thus institution include mission.
1556,1735,2021-04-28,08:39:41,Transfer,1740.96,Home young face cut might lay daughter.
1557,1422,2020-11-05,13:25:48,Deposit,2324.81,State still just agent cover always.
1558,2330,2024-03-26,11:11:38,Withdrawal,937.72,Population east official enough establish.
1559,2220,2023-02-01,09:03:53,Deposit,6092.21,Lose several look strategy.
1560,945,2025-01-06,14:15:38,Withdrawal,1276.9,Compare send arm.
1561,610,2022-02-19,18:26:19,Withdrawal,31.98,Total author a peace.
1562,728,2024-04-26,02:26:24,Transfer,7449.35,Fine section material responsibility action listen.
1563,784,2025-02-12,12:35:33,Deposit,8061.47,Star between car.
