transaction_id,account_id,transaction_date,transaction_time,transaction_type,amount,description
632,634,2022-12-18,23:59:27,Deposit,7736.83,Rise laugh concern six someone book outside.
633,617,2025-04-01,01:51:04,Deposit,4932.7,Draw present put rather lay such investment.
634,895,2022-04-17,19:17:07,Deposit,9392.94,Anything phone key part teacher.
635,2074,2023-06-21,23:46:10,Transfer,9601.3,Some country other hear store hotel including.
636,1646,2021-01-22,22:29:00,Withdrawal,7303.83,Play study establish newspaper heavy market.
637,1815,2024-08-21,06:40:26,Deposit,2081.28,Poor defense hotel what might.
638,976,2020-12-01,09:06:54,Withdrawal,7977.73,Phone lawyer bring lead various election.
639,1283,2020-08-17,14:06:33,Deposit,6242.81,Whose at phone image national.
640,555,2022-01-04,17:14:46,Transfer,2883.76,Method light safe land left though around.
641,154,2022-07-21,06:20:21,Transfer,4734.44,A health night somebody.
642,220,2021-12-05,06:39:57,Deposit,8979.09,Late subject health live open especially see.
643,1780,2025-04-09,01:34:36,Withdrawal,7817.2,Full suddenly write page anyone.
644,685,2022-09-25,19:26:18,Withdrawal,4539.9,Anyone whole list yes policy.
645,2332,2023-03-09,11:36:12,Deposit,8420.16,Why blood foot suffer personal.
646,655,2022-01-04,19:51:02,Deposit,8429.27,Air case keep space road approach gun as.
647,1659,2022-05-29,14:08:52,Deposit,8050.45,Window thus organization course avoid its per.
648,1462,2021-07-05,02:12:31,Transfer,8471.03,Chair sense term enjoy.
649,1653,2020-12-04,13:28:13,Withdrawal,9459.18,North ahead something lose avoid score describe.
650,1159,2023-09-21,23:02:32,Transfer,4483.69,Activity them themselves himself act apply gas.
651,1990,2020-12-20,06:59:54,Transfer,5866.12,Face great because director necessary every.
652,892,2021-04-15,22:27:10,Transfer,6992.84,Rise American per event treatment.
653,1985,2025-04-07,10:04:51,Transfer,5747.41,Fly big couple chair fact.
654,1138,2021-05-22,23:18:00,Transfer,7898.04,Choose face remember at use bad.
655,2073,2025-02-26,12:52:02,Withdrawal,353.47,Increase near card state.
656,1291,2023-08-10,01:15:04,Withdrawal,151.92,Foreign player line Mr support.
657,851,2023-12-12,08:01:42,Deposit,8237.23,National impact respond important trade particularly foot.
658,1788,2023-11-29,04:50:55,Withdrawal,2172.62,Summer keep whether system there people man program.
659,912,2024-02-09,03:01:14,Transfer,2580.03,Billion whole each section that stand woman.
660,536,2022-08-18,10:03:09,Deposit,1577.92,Above present need forget tax.
661,2186,2024-09-24,19:20:27,Transfer,755.55,Other rest same collection seek.
662,428,2020-12-15,06:24:41,Withdrawal,6163.02,Boy you finally history form reach president.
663,1391,2021-09-24,09:48:59,Deposit,2522.26,
664,300,2024-01-18,10:31:31,Deposit,6853.71,Your medical know strong.
665,670,2021-01-12,19:35:44,Deposit,9097.09,Authority tonight national over best possible despite.
666,2176,2024-12-13,15:34:56,Transfer,9155.05,Book expect about pressure.
667,1230,2022-09-26,18:39:09,Deposit,8268.84,Effort tax discover yard purpose.
668,662,2023-06-06,16:46:57,Withdrawal,3982.94,Card wind travel ask quite forward when.
669,2065,2021-03-12,05:08:50,Transfer,4922.03,Evening risk quickly car government series policy.
670,2053,2021-08-03,03:03:36,Transfer,1422.02,Game because south common there action.
671,840,2020-06-17,23:54:05,Withdrawal,5263.34,Yourself my minute wind likely instead seat.
672,1979,2021-05-14,20:41:38,Deposit,3304.98,Leader knowledge civil medical for.
673,1189,2024-02-11,16:10:39,Deposit,3885.45,Who range back sense nor great movie author.
674,316,2020-11-03,01:28:25,Transfer,2007.29,Customer leg technology walk surface opportunity wonder.
675,2358,2020-10-21,19:14:30,Transfer,3707.08,Whatever later because act color street real.
676,2356,2022-02-07,08:41:16,Transfer,5369.44,Worker five tree despite form name box.
677,1111,2023-05-30,03:00:51,Withdrawal,254.77,Personal off always after.
678,2111,2022-09-17,00:01:41,Withdrawal,6870.12,Care onto significant speech view miss win.
679,2324,2021-05-06,14:50:16,Withdrawal,1936.05,Certain series security another help significant race.
680,989,2023-03-21,10:29:58,Deposit,8564.6,Turn throughout movement plant range yes and.
681,1822,2021-09-07,06:02:03,Deposit,2021.29,Realize training image respond image.
682,208,2022-08-01,12:27:29,Transfer,602.95,Thousand onto him tonight understand size.
683,1709,2021-12-15,11:19:01,Deposit,3848.07,Democrat sell many camera near guess bring.
684,406,2021-10-14,22:14:13,Withdrawal,3233.29,System science staff staff conference his.
685,1842,2023-09-29,18:38:07,Transfer,5070.61,Shoulder consider director college nor arrive space color.
686,1354,2025-01-26,20:09:33,Withdrawal,6658.44,Fact statement piece picture western.
687,1633,2023-11-21,08:54:20,Withdrawal,3284.5,Off visit will part them worker audience.
688,2022,2021-02-11,20:47:30,Withdrawal,1007.76,Country all everyone call long.
689,1044,2023-03-24,00:31:49,Withdrawal,4315.22,
690,215,2023-01-03,21:15:19,Withdrawal,5242.51,Single indicate thank security exist increase election.
691,1700,2023-02-02,13:32:52,Transfer,8559.8,Young benefit use begin right.
692,236,2023-10-01,08:39:33,Withdrawal,722.2,Successful main apply determine key.
693,1046,2020-08-05,03:39:09,Withdrawal,1074.05,Entire by car travel international them.
694,1052,2023-10-26,20:18:22,Withdrawal,2607.52,The serious ago story short industry.
695,2412,2020-07-06,03:09:57,Transfer,4728.37,Right project benefit marriage.
696,589,2024-09-19,03:51:31,Deposit,2023.89,Activity special every week local dog which.
697,2189,2025-03-27,19:15:54,Withdrawal,179.72,That certainly here out simple true.
698,1304,2024-03-30,16:49:48,Withdrawal,8673.96,People three miss whether job.
699,1854,2020-12-26,05:16:26,Deposit,9583.73,Research and he new serve offer.
700,187,2022-12-08,13:18:19,Transfer,2990.01,Glass join many such collection book.
701,631,2024-03-18,15:00:36,Deposit,5131.82,Western floor image low message like program involve.
702,711,2022-07-03,22:05:35,Deposit,7975.16,Cell agree attack join must theory wait.
703,199,2024-05-24,09:37:42,Transfer,6118.52,Despite program network red relate.
704,125,2022-03-27,16:01:23,Transfer,7770.82,Thing direction successful field why drop himself.
705,284,2021-09-06,23:10:25,Deposit,2698.46,Note property early section road tell.
706,2392,2022-07-01,00:57:41,Withdrawal,6383.32,News well very matter here truth.
707,1949,2020-06-27,02:04:30,Transfer,4853.06,Help agree as itself rather visit.
708,2359,2021-01-05,04:56:08,Withdrawal,1357.95,Sea tax society before partner resource.
709,627,2025-05-05,01:37:19,Transfer,2694.57,Issue cover into his both ground prove.
710,1595,2025-03-02,15:43:15,Transfer,2710.31,Look guy arm dinner less sell dark.
711,1302,2021-02-04,11:25:51,Deposit,4645.75,Assume coach produce still hit best.
712,1547,2024-12-05,13:24:33,Transfer,4926.51,Candidate as sport civil.
713,59,2021-10-13,09:31:12,Transfer,3225.46,Person so defense lawyer admit raise although dog.
714,913,2021-10-26,00:33:02,Transfer,2519.64,Operation own who grow leave life wide.
715,1380,2023-08-02,12:09:52,Transfer,8285.59,True poor against opportunity final case long why.
716,185,2023-05-01,09:24:25,Deposit,6582.03,Season cover history once reason.
717,691,2022-02-07,14:29:45,Transfer,6173.74,Various mention those.
718,182,2022-08-16,16:04:01,Deposit,9694.77,Guess research career hear face tend.
719,2173,2022-08-20,18:08:27,Transfer,9749.82,College game term author.
720,2133,2021-03-27,06:16:57,Withdrawal,6109.14,Say challenge thing month issue board.
721,1920,2022-04-03,17:20:34,Deposit,8445.4,Until degree girl between to.
722,932,2022-05-24,15:31:14,Deposit,5639.58,Buy prevent each cause.
723,1884,2022-03-20,23:17:41,Withdrawal,2864.17,Light read approach Congress week war.
724,1486,2023-08-11,16:58:49,Transfer,3659.34,Compare under baby bring billion one war near.
725,1265,2020-11-15,19:10:21,Deposit,5139.72,Once degree despite another present as might.
726,1095,2021-02-28,13:32:02,Transfer,5231.58,No yeah institution up class teach state member.
727,16,2025-03-28,09:02:52,Transfer,5224.6,Price professional media brother budget door.
728,2484,2023-03-01,03:03:24,Withdrawal,7869.21,Instead worker easy wall measure night gun.
729,1624,2025-01-28,10:57:20,Transfer,5147.89,Magazine week or matter leader news notice.
730,435,2021-12-23,09:11:29,Transfer,4208.64,Industry event up prevent various.
731,901,2024-12-18,08:32:26,Deposit,9711.03,Even event real water on rather.
732,1477,2024-06-21,18:54:55,Transfer,5490.88,Officer space trade eight.
733,1147,2021-09-10,08:08:24,Deposit,4597.87,Unit policy never need.
734,1199,2021-03-25,16:58:16,Transfer,2105.77,Hit office simple spring station couple pull.
735,1817,2021-05-17,00:47:12,Deposit,7000.94,Hot share heart quality result blood approach east.
736,745,2022-10-07,08:01:57,Transfer,2144.23,Thought white food instead note.
737,355,2022-01-22,12:17:47,Withdrawal,931.8,Trade couple end radio.
738,370,2020-12-14,12:16:25,Withdrawal,5413.41,Author listen wonder third.
739,601,2023-09-03,11:01:06,Withdrawal,8235.05,Weight fact process home.
740,2307,2024-11-16,23:33:08,Withdrawal,4149.05,Various around really song Republican.
741,96,2024-06-18,11:43:24,Withdrawal,9279.23,Low his benefit.
742,1885,2020-07-31,22:52:38,Transfer,1452.67,Probably step fund stuff.
743,488,2024-01-06,22:08:47,Withdrawal,6250.49,Tv minute take community thousand onto.
744,111,2023-07-17,21:52:13,Deposit,8840.2,Public eye itself soon even method worker move.
745,2348,2023-10-26,07:14:01,Deposit,368.76,Mouth many follow security.
746,1755,2024-03-18,01:27:32,Withdrawal,8240.98,Weight it degree its recently activity already.
747,2221,2024-10-09,11:25:28,Transfer,6381.24,Wall weight possible another interest whom record.
748,2262,2020-10-03,11:45:47,Withdrawal,8101.1,Ever join wear Democrat father according religious.
749,2380,2024-05-05,08:45:05,Withdrawal,7035.64,Full smile book window start deal.
750,1824,2022-12-08,18:03:06,Withdrawal,4969.03,Word like care range.
751,2431,2022-12-01,17:33:02,Transfer,783.17,Receive benefit woman green seat after.
752,2231,2021-09-11,20:02:28,Transfer,6246.91,Step any forward minute.
753,1854,2023-03-07,05:13:27,Transfer,2109.21,Debate college turn animal reflect so.
754,1445,2023-04-28,03:16:40,Transfer,657.37,Method nature industry whom he face adult.
755,238,2021-03-16,06:03:00,Transfer,5814.5,Information themselves common clearly dinner field bag.
756,2493,2024-10-16,22:56:48,Transfer,6275.6,Executive just respond reveal.
757,2253,2021-05-18,11:49:50,Deposit,5060.22,Start read call bag.
758,1816,2023-06-27,05:58:45,Withdrawal,2061.58,Simple seek operation moment.
759,638,2025-01-14,16:53:09,Deposit,6855.63,Level recognize establish somebody.
760,619,2022-09-12,10:37:10,Deposit,5940.84,He safe mother realize more.
761,739,2025-01-11,06:44:51,Deposit,9357.19,Fish evidence whole study experience.
762,2469,2024-05-18,00:10:11,Deposit,6324.03,Street without language large vote.
763,362,2024-05-01,08:06:47,Transfer,8786.15,Buy read standard music kind.
764,634,2021-07-19,08:51:50,Transfer,6473.94,Interest mention raise right former.
765,1586,2022-10-04,07:20:18,Transfer,7843.54,Store keep operation option.
766,549,2024-04-21,23:06:31,Deposit,6492.07,Even billion story.
767,1646,2023-04-27,12:52:20,Withdrawal,7155.53,Tough base house crime during nor think.
768,2442,2020-09-26,08:39:09,Deposit,8732.03,Camera media later serious wall.
769,2401,2024-09-20,13:57:42,Deposit,2202.27,Successful executive attack.
770,2415,2020-06-28,15:21:58,Transfer,1448.35,Officer opportunity mind free imagine above quickly image.
771,947,2024-01-05,08:16:12,Deposit,2756.26,Reach occur state not cost type.
772,1789,2022-02-11,23:45:43,Transfer,3044.84,Test region tonight.
773,190,2025-05-28,00:18:13,Deposit,7141.34,Among sure main quite move out consumer administration.
774,2011,2025-05-12,17:37:52,Withdrawal,4607.81,Water record minute they blue.
775,2125,2022-01-25,20:55:46,Transfer,8651.66,Exactly medical course participant.
776,783,2021-09-25,20:24:26,Withdrawal,3549.59,End house experience edge focus reality.
777,1995,2022-02-07,22:01:09,Withdrawal,2368.9,Certain popular same against.
778,700,2023-01-21,23:13:58,Transfer,8988.99,Letter mission minute produce may new.
779,1323,2020-07-22,19:12:26,Withdrawal,3409.23,Official energy expert account camera yes.
780,1304,2021-09-23,00:30:04,Withdrawal,6764.43,Something determine laugh window why.
781,521,2021-12-14,08:47:59,Transfer,945.21,Court me message smile early.
782,2472,2024-05-20,03:29:14,Transfer,8772.97,Parent movement term step site.
783,1122,2025-04-28,13:29:05,Transfer,8223.46,Show first development reach from physical fire vote.
784,1275,2021-12-15,15:27:11,Withdrawal,9818.74,Machine beat talk.
785,429,2025-04-23,09:04:07,Deposit,3120.52,Plant answer his concern contain especially present.
786,1980,2022-06-04,11:28:08,Deposit,6517.49,Door suddenly tax less.
787,625,2020-08-08,12:57:20,Deposit,9777.99,Mr act reach everyone your occur.
788,202,2022-06-04,22:55:57,Deposit,4011.96,Force always physical country sister term.
789,467,2020-07-09,23:13:37,Withdrawal,6281.57,Card campaign this environment skill or detail.
790,2187,2023-09-21,17:46:12,Transfer,755.73,Memory fish speak.
791,1794,2020-12-04,12:44:36,Withdrawal,6182.92,Official imagine ability send.
792,583,2023-09-17,16:31:35,Deposit,6391.71,Hear board thousand meeting.
793,1094,2022-01-02,02:13:43,Withdrawal,4269.25,Both provide than seat officer.
794,1688,2020-12-25,12:48:12,Withdrawal,5749.3,Camera condition there.
795,950,2021-10-21,05:06:06,Withdrawal,7259.04,Describe officer radio unit.
796,1222,2025-01-20,18:45:35,Deposit,673.27,Thus executive cost do already case require.
797,552,2021-03-07,05:13:06,Transfer,3199.79,Appear set outside suggest.
798,2043,2023-05-07,04:58:56,Transfer,6622.43,White a particular maybe.
799,1455,2022-12-27,18:13:52,Transfer,9449.58,Spend task product become.
800,657,2022-12-15,08:52:20,Transfer,9101.02,Player subject Republican people fight.
801,1799,2021-07-01,10:47:51,Deposit,1053.56,Life paper Mr beautiful image again blood.
802,2292,2021-05-01,23:27:15,Transfer,2091.69,Everybody TV rule sport real yourself.
803,2314,2021-02-15,03:21:35,Deposit,3320.95,Body under voice while purpose.
804,1247,2025-03-22,20:34:25,Transfer,1645.14,Spring image professor herself.
805,929,2021-09-12,10:47:23,Deposit,3007.86,Ahead agent natural place relationship couple short certain.
806,1528,2025-04-01,18:08:07,Deposit,5504.4,Lay health point reflect anything your firm go.
807,1042,2024-05-29,18:13:14,Transfer,2481.91,They international watch author.
808,1594,2021-09-02,17:12:57,Deposit,9467.87,Financial even affect direction give office candidate something.
809,1229,2022-07-27,12:38:20,Withdrawal,7949.14,Finally picture lawyer analysis.
810,1043,2022-02-21,06:30:02,Withdrawal,1775.09,News term meeting who style still.
811,2345,2025-05-06,18:17:49,Withdrawal,5452.25,Republican well carry reason.
812,1995,2025-01-29,16:45:11,Withdrawal,7409.83,Eye environmental center seek investment hope.
813,2498,2024-11-18,10:43:24,Deposit,4252.7,Floor art floor it present.
814,1380,2021-11-14,17:10:45,Deposit,9483.56,Energy boy series imagine face stock security.
815,316,2025-01-30,20:50:11,Transfer,6647.4,Near executive listen along professional its.
816,2261,2024-05-19,01:00:05,Deposit,6458.85,Successful certainly buy hundred.
817,406,2024-10-28,20:06:20,Deposit,7879.48,Statement development west grow court fear.
818,1121,2022-03-26,21:36:07,Transfer,4800.33,Pm individual law member culture brother wonder computer.
819,240,2020-11-19,14:49:13,Transfer,5912.08,Reach analysis guy else pass act.
820,834,2022-01-25,02:08:37,Transfer,4873.67,Appear Mr group ground pattern.
821,106,2023-07-24,21:56:12,Transfer,9962.28,Spring section recognize simply side wall economy then.
822,514,2023-01-07,10:05:15,Transfer,4056.63,Rule some sense admit head floor establish.
823,989,2021-03-13,23:28:03,Deposit,7708.8,Decision strong south threat now expect through.
824,621,2022-12-17,23:57:55,Withdrawal,9617.81,Contain message cell player.
825,122,2023-04-23,07:54:57,Transfer,7262.83,Three wrong fast just which too outside.
826,767,2023-12-13,03:38:01,Deposit,5582.72,About everything teach statement game.
827,1545,2025-04-15,11:06:54,Withdrawal,4602.2,Win mother purpose report attack.
828,1547,2024-02-26,08:13:21,Withdrawal,4144.49,Need collection prove as young writer rest.
829,7,2025-04-03,04:14:49,Deposit,9973.85,Girl clearly build travel.
830,986,2022-11-11,08:27:50,Withdrawal,1747.22,Each black base without.
831,132,2023-08-29,07:37:03,Deposit,7936.4,Hope through international development answer quite.
832,548,2022-02-07,09:37:26,Transfer,6992.49,Ok their bad how far learn.
833,2411,2023-07-26,07:12:59,Transfer,405.78,Responsibility note support enough hope road.
834,856,2024-03-24,20:35:19,Transfer,4382.8,People without real crime quickly past.
835,905,2021-09-21,07:04:05,Withdrawal,4887.34,Thank energy big hotel southern thought turn.
836,67,2023-07-22,23:30:45,Deposit,4748.79,Seem top I add defense him.
837,296,2023-05-10,03:13:27,Withdrawal,1505.7,Boy break argue now impact number.
838,1654,2022-05-18,20:00:01,Deposit,2750.73,Exactly once image child.
839,673,2023-02-08,12:24:22,Deposit,2460.68,Institution true me firm general.
840,257,2022-01-14,01:04:19,Withdrawal,3047.41,Deal market show know piece attorney say.
841,1477,2022-05-12,13:59:45,Withdrawal,8818.0,Increase wait break western we.
842,1544,2024-01-28,10:01:08,Deposit,1109.34,Significant and Democrat second friend daughter.
843,2006,2025-02-12,04:31:28,Deposit,3802.3,Into science production guy.
844,2395,2023-02-03,15:29:31,Withdrawal,7353.29,Physical point physical hotel memory find feeling.
845,1372,2024-08-29,10:21:30,Withdrawal,5830.65,Whole protect he.
846,749,2024-04-20,05:27:46,Withdrawal,6856.24,Investment student data heart these.
847,1077,2021-11-23,14:08:07,Deposit,2993.32,Mr issue condition material.
848,887,2021-08-31,23:25:57,Transfer,3240.53,Difference hold way woman industry discuss parent.
849,1371,2023-09-03,22:32:44,Withdrawal,644.82,Use tough marriage.
850,854,2024-09-01,07:27:06,Withdrawal,7797.08,Until program including Republican.
851,1048,2023-12-19,14:25:01,Transfer,3999.31,Least it good soon wrong.
852,2185,2024-06-14,01:14:48,Transfer,2294.65,
853,1921,2021-06-19,11:50:05,Deposit,9567.45,Agreement choose house water process.
854,1480,2021-07-17,00:22:45,Withdrawal,3785.93,Technology old effort until risk.
855,343,2021-12-10,00:27:43,Withdrawal,6869.51,Organization beautiful involve Mrs training.
856,811,2024-01-21,03:55:36,Deposit,3582.41,Son player ago other turn.
857,2410,2024-07-12,11:41:21,Withdrawal,5264.57,White each mind set.
858,1298,2024-08-20,22:38:58,Deposit,644.64,Place see go share wide.
859,34,2020-07-16,06:52:14,Withdrawal,149.5,Station positive strong American sit.
860,999,2021-03-13,17:18:12,Withdrawal,4960.52,Current quality arm notice ready film pay.
861,389,2023-07-23,23:10:50,Transfer,1951.25,Beat amount create want story open themselves.
862,1532,2024-12-13,23:00:42,Transfer,525.47,New pretty agreement else southern.
863,2196,2022-09-27,13:46:33,Withdrawal,9650.64,Avoid image politics push cut about.
864,845,2022-03-03,11:13:45,Transfer,852.23,Moment create very because speak.
865,266,2020-07-27,12:14:24,Withdrawal,2296.11,Skill middle truth fire present thus yet.
866,1690,2025-06-01,20:10:23,Deposit,6316.76,Growth remain education result apply feel operation.
867,61,2024-09-22,09:50:44,Withdrawal,7986.33,Step Mrs out central.
868,1869,2025-04-16,11:31:45,Deposit,462.92,Full example tell enjoy environmental.
869,2149,2025-01-24,08:55:21,Withdrawal,4238.21,Age teacher join speech present which option over.
870,1861,2021-08-01,23:30:28,Deposit,4071.4,Short record soldier knowledge.
871,10,2024-11-11,03:18:12,Deposit,8638.61,Happy policy interesting its another.
872,811,2021-05-26,19:39:30,Deposit,9245.73,True in store pay itself these wind.
873,1525,2022-07-09,03:11:12,Withdrawal,1800.27,Yes nice goal nearly economic.
874,51,2025-04-26,06:27:34,Withdrawal,342.07,Language rule plan art boy quality.
875,223,2022-07-10,13:15:46,Deposit,9589.79,Build support child concern risk.
876,1374,2023-11-27,00:33:17,Transfer,6916.91,Table energy create hard.
877,78,2024-04-05,02:00:53,Transfer,3271.14,Admit world maintain pay.
878,689,2021-01-16,06:48:42,Withdrawal,7411.6,Interesting here cost particularly short small professional.
879,629,2024-04-12,22:10:32,Deposit,4043.12,Work have finally reach.
880,423,2022-06-11,13:31:10,Withdrawal,763.12,Like police reduce.
881,2412,2024-07-09,08:16:15,Transfer,1425.26,She pull history.
882,1646,2025-02-17,19:23:59,Withdrawal,8929.44,Let enough popular follow speak shoulder.
883,2128,2022-10-27,14:33:17,Deposit,1295.96,Turn image pull vote guy practice stuff.
884,1139,2022-03-21,11:53:48,Deposit,324.76,Affect quickly ball seek pull such.
885,2405,2021-11-07,10:33:59,Deposit,1850.05,Conference again three market.
886,1526,2024-02-04,14:30:37,Withdrawal,1406.98,Kid your always beat organization.
887,190,2020-10-26,12:24:43,Deposit,1147.58,Agreement right even campaign hundred medical.
888,2189,2023-05-19,15:31:45,Withdrawal,2098.67,Second ever factor want form win between.
889,789,2021-02-10,22:02:51,Deposit,6421.01,Moment next development civil spend theory.
890,2118,2022-07-22,16:39:41,Withdrawal,9554.02,Many get later create sort race.
891,880,2022-09-16,21:43:15,Deposit,2440.14,View will investment save most past.
892,1375,2020-12-03,11:16:02,Withdrawal,6795.96,Decade address too whatever some fact it.
893,888,2022-09-29,13:18:32,Withdrawal,1864.85,Professional admit million cold public air enter.
894,1221,2023-04-30,22:16:11,Transfer,4432.76,Effect newspaper happen mention wear pick.
895,710,2021-12-03,19:15:54,Withdrawal,5840.66,Ok do name.
896,792,2023-06-04,04:51:18,Withdrawal,1746.94,Rather lay song possible enough.
897,2390,2024-10-21,03:35:56,Withdrawal,2482.7,Discussion theory minute stop state travel agreement.
898,1940,2024-06-12,01:48:34,Transfer,9050.06,Yourself director reflect operation that.
899,1134,2023-08-28,11:55:09,Transfer,5732.76,Situation whatever technology region consider always.
900,1477,2024-11-02,01:06:06,Deposit,6222.09,Woman seek friend say talk there once unit.
901,1460,2022-02-19,12:41:17,Withdrawal,8350.04,Site method yard trip happen.
902,728,2023-12-15,04:30:12,Withdrawal,9818.55,Kitchen trip bag your hold.
903,1362,2024-09-26,05:49:16,Transfer,8472.16,Sit since where present sound.
904,1598,2025-03-04,14:08:31,Deposit,3703.62,Picture sort financial girl capital commercial.
905,2093,2024-11-02,14:46:25,Deposit,6199.69,Oil expert according large for.
906,1230,2021-12-06,20:51:42,Deposit,2673.34,Of best Republican get threat home minute.
907,1514,2022-08-24,09:55:07,Deposit,2499.64,Assume value suffer his run artist.
908,1520,2021-05-05,20:10:25,Deposit,2892.55,Too put several who side response air.
909,1110,2023-11-15,18:18:02,Withdrawal,4348.68,They in condition everybody design.
910,956,2020-09-24,18:45:22,Withdrawal,2091.7,Traditional same point manage say front.
911,1671,2022-06-10,20:24:42,Deposit,7621.27,Necessary industry least degree stuff agreement TV.
912,2362,2021-04-12,03:47:21,Transfer,8883.38,Everyone no bank they.
913,632,2024-07-25,01:52:42,Withdrawal,2033.45,What tax fear enter report nation girl.
914,1591,2023-12-16,03:07:26,Withdrawal,9238.55,Real lose industry center stop.
915,423,2024-12-29,21:52:26,Withdrawal,4753.46,Around century detail body health industry window culture.
916,1875,2024-10-17,00:11:21,Transfer,6981.44,Knowledge year charge make whether.
917,805,2021-07-22,02:14:47,Transfer,6256.71,Recognize sense type whether sea.
918,1328,2021-04-17,14:57:21,Withdrawal,2132.9,Care of try pass seat wrong.
919,1683,2021-01-03,08:04:04,Transfer,3291.95,Audience environmental trade kid letter budget.
920,1010,2022-03-08,16:23:41,Transfer,5781.73,Past cup anyone some central save.
921,415,2024-05-30,00:18:42,Withdrawal,7309.98,They born million off not next.
922,2317,2022-11-05,09:31:15,Withdrawal,5906.47,Already candidate political start property.
923,2493,2022-05-16,18:36:34,Transfer,7875.4,Today my note example policy hear figure.
924,394,2024-10-15,12:44:40,Withdrawal,8605.84,Simple nature city ability particularly gun.
925,2049,2022-08-05,03:42:15,Deposit,1024.05,Mean home life fund.
926,2111,2024-04-18,01:17:46,Transfer,1975.37,Seek important night away wide.
927,120,2022-04-08,05:29:15,Deposit,240.98,Stay public staff world you customer thought major.
928,1942,2022-01-22,00:13:27,Deposit,3801.6,White probably style minute.
929,681,2023-01-02,13:50:59,Deposit,9430.42,No which should certainly minute.
930,1736,2021-08-27,17:20:57,Withdrawal,9589.67,Do particular board west behavior live property.
931,79,2024-02-06,17:37:08,Transfer,8963.41,Represent still clear war bad.
932,1127,2021-11-20,05:20:48,Transfer,2087.98,Challenge those language along offer heavy.
933,502,2022-11-22,14:41:24,Withdrawal,3988.34,Charge yard pick size the good.
934,1220,2021-10-07,01:33:28,Withdrawal,3974.64,Despite increase check participant choose.
935,1139,2020-10-13,15:45:57,Deposit,7489.17,Type employee true thing upon inside.
936,674,2024-09-03,01:35:01,Withdrawal,8426.06,Key answer another stay not.
937,1661,2023-08-25,17:35:42,Deposit,9172.44,Low wife do medical more risk.
938,446,2023-05-17,08:46:19,Withdrawal,1395.56,New reach learn wish little side successful.
939,2412,2025-03-11,09:35:26,Transfer,8993.79,Pay read responsibility line star ball.
940,1620,2025-03-23,19:32:16,Transfer,2630.02,Trouble measure because near small more.
941,328,2024-02-10,00:16:09,Transfer,1107.27,Own letter environment me leg.
942,1570,2025-05-08,13:28:24,Transfer,2928.4,Bad teach would there seven act any.
