transaction_id,account_id,transaction_date,transaction_time,transaction_type,amount,description
1,373,2024-11-26,17:53:16,Deposit,8056.18,Friend really success though find center compare.
2,1658,2024-08-28,11:31:07,Transfer,2862.5,Beat decision sound.
3,2195,2021-07-27,03:10:47,Withdrawal,2560.44,Station fine evidence teach several community.
4,2105,2024-01-26,15:15:18,Transfer,4218.8,Party through company meeting.
5,1554,2021-04-30,11:32:24,Deposit,9079.47,Natural away explain section room red professor lead.
6,1103,2024-09-13,23:18:39,Withdrawal,4567.3,Determine computer anything operation military represent defense chair.
7,946,2022-05-29,19:58:32,Withdrawal,8210.44,Full goal design level place tree work.
8,363,2024-02-18,19:50:47,Transfer,1104.26,Their response its with.
9,1195,2023-06-28,04:44:18,Transfer,8465.24,Law sound yard feel.
10,1791,2023-10-06,09:50:51,Withdrawal,445.68,Write generation PM never majority play policy Republican.
11,2168,2024-10-19,22:46:37,Deposit,3936.45,Us turn protect put then find ten.
12,524,2025-04-12,12:20:35,Deposit,7856.38,Impact level boy again finish.
13,1142,2023-02-26,08:47:12,Transfer,2697.47,Between respond way good.
14,1840,2021-04-13,22:12:56,Deposit,5046.66,Us southern personal but miss somebody paper.
15,2352,2023-09-14,21:29:48,Transfer,4108.08,Head month agree maintain.
16,768,2024-09-26,23:52:30,Deposit,7147.01,
17,271,2021-07-13,07:14:22,Deposit,2001.03,Tough statement role think medical politics green.
18,608,2023-11-30,13:22:25,Deposit,3599.2,Control hospital hear then attorney.
19,853,2021-04-12,00:30:11,Deposit,29.76,Should loss particular gas east shake take then.
20,2247,2021-07-11,15:21:50,Transfer,3775.26,Painting those report base.
21,1652,2020-06-20,16:28:12,Withdrawal,2400.33,Program community relationship allow.
22,20,2024-06-28,17:03:56,Deposit,5166.42,Call wear half story build.
23,2328,2021-12-31,13:13:02,Deposit,1221.97,Southern dark federal.
24,11,2025-04-03,23:55:50,Deposit,5800.65,Foot require western daughter.
25,379,2021-02-25,07:29:32,Withdrawal,5681.5,Simple bad arm pressure.
26,624,2023-10-27,22:28:34,Deposit,1397.25,So modern hit thousand.
27,1871,2024-04-30,16:08:38,Transfer,8318.38,Not manager vote decide.
28,2365,2020-08-18,14:30:13,Transfer,4603.71,Feeling far people body blood win.
29,184,2021-09-21,07:03:56,Withdrawal,98.97,Top about us oil cover.
30,1380,2021-05-04,21:25:50,Withdrawal,5437.83,Prepare soon usually everything according together.
31,337,2023-12-18,00:18:03,Transfer,4258.32,Body news race reality picture establish important.
32,1592,2021-05-26,21:11:44,Deposit,415.9,Fast four very doctor.
33,2445,2022-11-08,03:27:22,Transfer,5155.35,Single store sit.
34,1021,2024-03-17,17:38:30,Withdrawal,1196.22,Sure role get yeah everybody movie approach.
35,1001,2021-08-01,23:32:42,Withdrawal,833.99,Rest woman rather can network approach.
36,349,2024-02-24,05:47:13,Withdrawal,933.74,From large court risk.
37,1513,2022-11-15,00:19:38,Transfer,2598.79,Go voice Republican open if.
38,2349,2024-08-13,06:15:56,Withdrawal,1509.31,Assume strong surface whom.
39,1065,2022-02-04,19:22:38,Transfer,130.26,Decade everybody customer risk bill raise.
40,1327,2024-11-14,19:14:43,Deposit,2784.56,Forward themselves young young.
41,1829,2022-01-13,21:38:25,Withdrawal,3756.87,Least draw decision election table.
42,2447,2021-07-12,05:52:16,Withdrawal,2841.0,Information peace meeting while practice vote create.
43,1120,2021-10-31,21:24:37,Withdrawal,4325.1,From contain wind language land.
44,220,2023-10-28,18:09:41,Deposit,595.02,Account discover effort them detail live act month.
45,66,2024-08-30,17:40:40,Deposit,7066.34,Rock cell consumer bar radio phone civil.
46,376,2020-11-04,20:56:48,Transfer,5074.89,Activity change product example whole.
47,912,2020-11-10,08:45:33,Transfer,4472.92,Question nation political need health.
48,1184,2022-04-01,19:27:53,Deposit,1501.43,Soldier by finish.
49,577,2023-12-17,08:02:58,Deposit,5313.48,Cup help not policy country the meet.
50,287,2023-01-18,00:49:03,Withdrawal,2628.18,Paper look reason fly.
51,557,2021-06-06,11:36:57,Withdrawal,2281.74,Family firm fly recent others.
52,790,2024-09-11,01:19:34,Withdrawal,3122.61,Man firm find thousand must.
53,911,2021-03-19,01:00:31,Withdrawal,9957.5,Moment hour huge industry director spend continue.
54,1207,2024-10-25,03:27:46,Deposit,1603.11,Owner best employee.
55,2294,2021-06-01,03:05:59,Deposit,5521.09,Common paper less accept green worry project.
56,2249,2021-06-05,03:57:30,Deposit,6869.32,This want investment poor would.
57,724,2023-11-01,23:23:49,Transfer,9745.78,With up interest range.
58,74,2022-10-14,11:52:40,Withdrawal,6658.93,Leader sound give.
59,469,2022-03-01,02:59:22,Deposit,617.71,End hand clearly north determine.
60,898,2023-03-24,19:33:16,Deposit,2652.38,Board realize child relate those suffer.
61,221,2023-01-03,22:08:05,Deposit,1286.59,Already nothing language wonder standard prove.
62,588,2024-02-21,17:58:14,Withdrawal,875.79,Event trip raise discover.
63,720,2022-12-31,15:00:23,Deposit,9836.26,Fine magazine oil his.
64,1750,2022-03-14,11:18:01,Deposit,3514.97,Change public summer beyond experience other understand western.
65,1084,2023-05-05,18:23:41,Transfer,7156.15,Party mind different set.
66,1759,2021-02-21,05:20:47,Withdrawal,7516.79,Read method language enough step single.
67,1060,2024-04-08,09:03:39,Withdrawal,3824.54,Street true current about as beautiful.
68,1252,2021-04-14,14:04:16,Transfer,1785.27,Education student production world hour owner walk protect.
69,1802,2024-09-30,01:58:56,Withdrawal,9875.88,Rather require garden result new left weight.
70,1229,2020-08-21,17:16:32,Withdrawal,8253.92,Back ask south seven on.
71,361,2025-01-01,08:22:11,Withdrawal,2373.61,Prevent building business loss collection bag.
72,840,2021-07-29,22:56:35,Transfer,3098.19,Financial father bank cold coach quickly.
73,1063,2024-09-21,19:41:00,Deposit,3503.73,Power air boy sea generation.
74,341,2022-10-22,01:57:53,Withdrawal,9991.74,News wonder already find.
75,669,2025-05-31,21:34:01,Withdrawal,7571.05,I street building television character.
76,517,2023-07-06,06:39:11,Withdrawal,6685.1,Offer someone policy too hundred the beyond.
77,1856,2023-04-23,01:14:39,Deposit,5098.79,Author network join subject environmental put can.
78,1587,2025-05-18,20:22:22,Withdrawal,9319.5,Out win focus provide store hold change.
79,626,2024-12-14,17:10:33,Deposit,2767.86,System notice may space me.
80,1811,2024-08-02,09:19:14,Withdrawal,8524.49,Production Mrs son executive share million usually away.
81,1105,2021-12-14,07:32:50,Transfer,2941.58,Down notice alone own.
82,330,2022-03-13,10:06:00,Transfer,1604.84,Amount hot less difficult cause establish white.
83,851,2022-03-30,13:36:34,Withdrawal,160.3,Book suffer worry somebody.
84,446,2024-12-31,00:37:23,Transfer,3040.05,Religious light time it.
85,1235,2024-10-08,02:19:20,Deposit,1264.29,Run trouble mean white school apply issue.
86,1114,2023-12-18,10:29:35,Deposit,3082.92,Heart particular method worker social.
87,1718,2023-06-17,12:25:49,Transfer,7541.46,Business south me.
88,453,2025-03-03,20:28:30,Deposit,877.94,Lawyer size money four safe film.
89,1773,2024-04-16,10:50:51,Withdrawal,6049.97,Sometimes party among political usually themselves.
90,671,2025-04-24,00:46:49,Withdrawal,2575.21,Call rule easy my up.
91,71,2023-11-02,17:19:16,Withdrawal,6602.65,He just politics yes worker test style science.
92,1160,2023-10-20,23:20:42,Transfer,8185.42,Last modern purpose laugh level.
93,415,2025-02-19,23:32:37,Transfer,7105.47,Mrs name lay what situation real.
94,802,2020-10-17,00:49:53,Transfer,5508.81,Full force fish hope real see.
95,1899,2022-03-30,00:54:25,Deposit,35.19,Wish necessary sense decade people.
96,957,2021-08-27,06:03:50,Withdrawal,2261.22,Technology town whose consumer arm.
97,1178,2024-08-23,14:00:10,Transfer,8745.57,Near control air poor land visit say.
98,733,2024-09-12,04:56:26,Transfer,657.08,Trip begin discussion.
99,2404,2023-04-24,05:51:53,Withdrawal,5373.04,Street notice use design management likely say.
100,1660,2020-07-08,11:18:31,Withdrawal,8663.05,Outside operation quite candidate.
101,403,2021-10-10,22:58:07,Deposit,9929.7,Doctor know season fly.
102,660,2024-06-29,12:01:55,Withdrawal,3116.91,Product threat any.
103,1143,2024-06-24,07:12:08,Deposit,8023.45,Own bad why word page.
104,121,2025-01-15,22:22:55,Deposit,7085.25,Their in institution fine dream.
105,2163,2021-09-19,16:28:07,Withdrawal,51.87,Night because nature reach research design.
106,2035,2022-08-01,15:29:13,Deposit,1013.8,Store truth see section street.
107,2070,2022-02-24,19:53:39,Withdrawal,538.19,Audience rest artist material increase paper.
108,669,2023-07-25,05:18:46,Deposit,9995.03,Town result movie measure.
109,2436,2021-02-04,11:24:28,Withdrawal,5512.08,Record participant eye together sometimes throw.
110,2476,2025-05-19,00:00:10,Deposit,811.02,Us as per sea.
111,133,2025-05-22,07:23:10,Deposit,2106.47,Research mission ok popular chair ask.
112,1945,2020-10-15,15:45:53,Deposit,2414.61,Out military avoid according citizen challenge something.
113,2034,2024-09-10,12:08:54,Transfer,998.03,Million song before three finally buy.
114,2273,2024-10-15,23:12:51,Withdrawal,465.42,Film vote economy fund magazine.
115,1590,2021-08-21,06:21:19,Deposit,7607.99,Serve begin many former enjoy see analysis Democrat.
116,209,2021-07-27,20:57:12,Transfer,5078.19,Bank owner hear tree others.
117,1167,2021-04-04,11:48:00,Transfer,4671.93,Political school know official special.
118,1494,2022-07-02,17:41:09,Deposit,6290.58,Agreement section check sure.
119,1793,2021-09-08,11:42:31,Withdrawal,2242.33,Focus rather data.
120,489,2020-12-07,01:44:06,Deposit,4730.76,Interest night example at.
121,2165,2025-02-14,19:29:52,Transfer,8673.61,Skin street TV particularly beautiful light into.
122,15,2024-12-29,15:33:18,Withdrawal,1384.64,None indicate rich after.
123,231,2021-11-27,12:42:25,Transfer,2274.71,Manage soldier national because we read three as.
124,1702,2020-09-15,07:47:14,Deposit,4273.25,General or condition another.
125,2098,2023-05-23,23:43:26,Deposit,7794.18,Long newspaper suddenly foot.
126,634,2021-06-21,05:49:52,Deposit,8938.64,Throughout story message world.
127,2409,2023-02-05,21:41:34,Transfer,9878.56,Walk station ever nor health amount.
128,2009,2023-01-06,04:00:24,Deposit,5359.38,Scientist probably beautiful security add else southern service.
129,929,2024-07-15,14:44:40,Deposit,4479.61,Threat stock next.
130,435,2024-03-18,13:27:18,Deposit,1828.79,Hit claim the mission.
131,62,2022-08-16,04:37:59,Transfer,7230.72,Do quickly focus present.
132,1442,2021-12-12,05:16:34,Withdrawal,8672.64,Arrive lose live agreement.
133,61,2022-06-28,08:14:31,Deposit,6516.81,My cup source team job life.
134,1201,2021-02-28,08:30:53,Deposit,7986.04,List apply meet teach staff cut.
135,1619,2024-10-10,23:11:29,Deposit,1631.07,Enough herself find.
136,1601,2023-05-14,14:36:42,Transfer,390.13,Speak fight travel resource possible.
137,2468,2024-09-26,03:53:56,Transfer,7636.55,Subject station professor laugh.
138,1868,2022-11-23,22:42:38,Withdrawal,3990.12,Phone rich cultural discover evening administration.
139,1594,2020-11-01,20:02:22,Withdrawal,6825.58,Natural ball brother production world door.
140,1790,2020-06-26,01:28:09,Transfer,6904.03,Own guess study professional.
141,1494,2022-10-22,15:18:46,Transfer,7488.19,Whole pressure she similar.
142,582,2024-03-25,08:47:51,Deposit,3225.32,Degree computer writer past daughter.
143,1666,2024-12-20,11:50:38,Withdrawal,8236.28,From simply game price talk through.
144,19,2020-07-17,17:21:17,Withdrawal,9278.16,Adult couple religious sense well purpose office.
145,1491,2021-10-05,14:15:28,Deposit,9792.46,Hard defense contain sing evidence foot national raise.
146,2141,2021-04-21,08:16:26,Withdrawal,8928.95,Box cold boy enter rock operation.
147,868,2024-10-07,17:25:16,Transfer,7483.1,Adult last know away reach.
148,2205,2024-01-16,08:37:10,Deposit,5783.09,Beyond all rise run.
149,1200,2021-05-24,04:43:11,Transfer,668.92,Finally parent north data believe.
150,1235,2023-07-08,17:12:48,Deposit,7388.52,Sure skill tell fly big.
151,306,2023-03-31,19:12:06,Deposit,3170.76,Heart somebody very citizen yourself today political.
152,604,2020-11-10,21:19:46,Deposit,3689.33,Fine culture stuff free.
153,1951,2025-01-18,16:09:14,Transfer,3653.64,Direction although and certainly list second actually.
154,2254,2024-12-21,18:38:32,Withdrawal,6985.88,Head population work might end carry director.
155,1004,2021-02-23,20:11:12,Deposit,6680.79,View also street source financial book feeling.
156,1352,2021-08-24,20:50:41,Deposit,3105.48,Father hold discussion through everything experience life.
157,13,2022-01-18,17:25:15,Withdrawal,180.59,Indicate skill spend surface pay teach character generation.
158,1132,2021-02-22,07:03:25,Withdrawal,4211.91,Scientist let so spend test country.
159,637,2022-06-04,02:14:32,Withdrawal,5060.59,Despite perhaps new gun note.
160,1739,2024-10-23,04:29:22,Deposit,3207.37,Might fall determine pull trade deal.
161,1381,2022-09-12,06:55:47,Withdrawal,7447.16,Central again woman.
162,456,2020-11-21,03:30:35,Deposit,5464.63,Social someone develop before.
163,1840,2021-06-12,04:12:52,Withdrawal,3301.86,Actually general window life society.
164,960,2021-11-21,23:12:28,Transfer,3727.44,Town education figure save explain voice.
165,2076,2023-04-19,23:27:30,Deposit,3420.25,Unit use plant long from.
166,1542,2023-06-23,07:01:22,Transfer,465.69,Challenge director certainly play next under bag.
167,2452,2024-05-07,23:41:15,Withdrawal,1616.15,Ok force middle task.
168,78,2020-09-14,11:49:28,Deposit,2963.4,Social stand travel business herself.
169,1515,2023-06-05,23:07:16,Withdrawal,4234.29,Central figure spring stage Democrat.
170,579,2025-01-29,07:58:17,Deposit,3587.45,Apply whatever coach moment.
171,112,2021-10-11,11:44:19,Withdrawal,2043.71,Loss fine end theory.
172,1900,2021-08-27,18:42:25,Deposit,3622.92,Agreement here garden food Congress.
173,1969,2023-07-31,15:39:49,Transfer,9949.13,Close return easy.
174,1971,2020-09-15,15:32:50,Transfer,7229.37,Mean positive result role.
175,1994,2023-03-26,22:39:52,Withdrawal,3075.89,Education process miss compare.
176,66,2022-05-18,03:57:51,Deposit,8887.79,Tough animal of prevent market.
177,299,2021-03-27,08:00:22,Withdrawal,5037.52,Reveal step certain service.
178,1881,2023-12-01,23:28:32,Transfer,1818.87,Reveal wide believe describe.
179,2305,2022-09-04,11:04:52,Deposit,3329.98,Someone easy arrive television focus.
180,1616,2023-05-31,20:40:47,Transfer,5285.49,Course piece build enter take position.
181,1847,2024-05-26,12:05:27,Deposit,5554.46,Yes argue late edge.
182,188,2021-08-10,16:31:41,Withdrawal,4172.03,People investment guess mouth hand.
183,43,2021-05-09,18:08:15,Withdrawal,6530.5,Blood a serious turn should.
184,848,2024-04-08,07:33:12,Deposit,4787.57,Price every in task ok send.
185,846,2021-09-26,01:12:11,Withdrawal,2090.38,Maintain that work.
186,1643,2024-07-01,18:12:33,Withdrawal,4181.51,Indeed suggest cut sense discover.
187,2473,2021-05-31,20:47:17,Deposit,2186.7,Factor during material power.
188,2065,2020-12-14,22:16:15,Withdrawal,6077.74,Most south either sign those type.
189,124,2023-10-19,10:35:44,Withdrawal,5174.95,Dream anyone idea read.
190,1612,2024-09-08,01:43:35,Transfer,6797.44,Enough fact customer hour direction watch between.
191,1371,2020-08-06,03:34:50,Withdrawal,7776.43,Fear cold strategy option source.
192,1421,2020-06-28,05:56:29,Deposit,6876.17,Share rather data travel party.
193,2474,2023-10-15,05:50:40,Deposit,4747.91,Source outside cultural despite represent term test.
194,344,2021-11-07,19:37:11,Withdrawal,5965.85,Score fact relate indicate.
195,1055,2023-12-24,03:51:19,Deposit,3149.56,Western Mrs still through.
196,1318,2023-12-11,21:54:43,Withdrawal,4507.82,Article decade assume begin hold despite society.
197,2049,2021-06-25,11:30:20,Transfer,8819.54,Power trial write operation specific fear main.
198,1389,2021-12-22,12:31:37,Withdrawal,2554.36,Game through window kind skill.
199,316,2024-05-04,11:09:24,Transfer,7047.59,Receive case human society.
200,2159,2022-10-13,17:46:45,Withdrawal,1480.15,Important town send determine although letter most.
201,861,2021-12-06,18:12:16,Withdrawal,7498.3,Policy statement new themselves listen.
202,845,2024-08-19,03:16:18,Deposit,605.77,Professor half industry performance avoid.
203,604,2024-09-28,00:40:29,Withdrawal,1041.84,Today billion himself him whose of local.
204,1904,2022-05-01,09:25:58,Withdrawal,6515.98,Up government rate speech.
205,2486,2024-05-23,06:04:18,Deposit,9687.43,Feel tonight model south ability.
206,674,2022-12-17,18:44:26,Deposit,7796.58,Put lead program that clear doctor positive simply.
207,2225,2021-04-21,21:51:48,Withdrawal,1149.06,Ten traditional reduce participant American know.
208,2263,2021-08-03,04:57:49,Withdrawal,5775.47,Music think discussion southern interview season.
209,1536,2024-04-24,22:27:46,Deposit,9400.57,Perhaps history tell campaign draw.
210,2370,2020-07-22,00:43:15,Deposit,2081.23,Guess action across next box cultural member.
211,734,2024-09-19,14:11:33,Deposit,305.58,Best least trouble.
212,1693,2025-02-01,05:25:04,Transfer,7949.19,Above worry politics others.
213,1091,2024-09-08,03:54:59,Deposit,6789.3,Prevent risk Mr I true company increase attention.
214,318,2024-02-01,11:38:36,Deposit,4228.81,Thought need about.
215,293,2025-03-25,11:57:28,Withdrawal,4650.89,Color who quickly family.
216,80,2023-10-05,08:39:34,Deposit,8064.17,Win including begin recognize.
217,795,2023-07-08,17:49:16,Withdrawal,8872.07,Huge year support great marriage appear.
218,1403,2022-04-26,09:02:35,Transfer,117.7,Cut senior compare worry purpose miss agent.
219,2390,2025-05-17,11:09:39,Deposit,2094.7,Cost house out lawyer.
220,1880,2022-08-17,18:56:42,Deposit,2545.51,Half know think cold decide fire need.
221,2366,2022-09-08,01:10:38,Deposit,8529.59,Ago speech focus life answer per item.
222,1805,2023-10-06,13:12:34,Deposit,5636.38,Southern onto include response state total.
223,1775,2021-05-27,21:53:51,Deposit,9159.64,
224,911,2021-02-13,20:01:08,Transfer,334.79,Important analysis discussion resource risk animal.
225,1332,2021-02-18,14:36:40,Withdrawal,618.05,Likely I walk another condition add possible.
226,2253,2022-08-02,11:43:22,Withdrawal,1096.17,Final candidate memory carry gas Congress.
227,2477,2020-09-16,06:29:49,Deposit,1280.93,Big yeah will pressure husband.
228,2021,2021-05-20,07:24:07,Deposit,5413.77,College election spend.
229,2346,2020-09-06,23:16:46,Deposit,8224.24,Black this notice idea end.
230,196,2021-10-24,20:31:12,Withdrawal,9749.65,Best simply floor respond night instead.
231,1759,2023-03-19,03:31:08,Deposit,1263.13,Pressure computer challenge until speak have win check.
232,1720,2022-02-02,02:47:29,Withdrawal,3957.38,Expert cultural act big.
233,704,2022-06-21,12:34:47,Withdrawal,8631.5,Member water wait officer.
234,1245,2022-12-05,09:39:12,Withdrawal,9772.53,Outside on your.
235,1085,2023-12-26,16:13:53,Transfer,7491.7,Rock natural necessary campaign small line art.
236,96,2023-01-15,13:16:49,Withdrawal,7230.63,Manager prevent difference instead.
237,2237,2024-01-25,05:39:13,Withdrawal,3020.51,
238,2029,2020-12-01,02:15:32,Withdrawal,7537.84,Tonight level fire up country beyond popular.
239,89,2024-05-18,22:57:27,Deposit,455.5,Pay also course provide sea four rest.
240,424,2024-10-09,18:30:37,Transfer,9598.71,Future room edge Congress student later weight discover.
241,2438,2024-05-24,22:41:44,Deposit,1667.38,Data wall about air toward eight west.
242,1522,2022-02-08,18:28:04,Withdrawal,8822.35,Rock population particular fine feeling size.
243,134,2022-09-15,03:19:43,Withdrawal,2597.89,Wall sport use almost.
244,142,2025-02-24,11:26:39,Transfer,2259.45,National company traditional couple development no.
245,1428,2024-11-30,11:15:49,Deposit,2480.19,Director teacher today as expect population however fire.
246,688,2024-08-05,15:02:16,Deposit,3581.63,Reduce be physical board.
247,1533,2024-01-12,09:27:05,Transfer,8055.55,Upon ten concern difficult break ok occur.
248,244,2021-10-07,14:29:04,Deposit,6185.74,Special record wrong leg any foreign Republican.
249,1383,2020-10-11,13:15:27,Withdrawal,3292.32,Travel minute even task choose decision.
250,137,2020-12-07,13:13:01,Deposit,8554.61,Student make form bring writer consider create.
251,2271,2020-07-04,02:47:27,Transfer,2855.52,Sound street up treat.
252,794,2025-02-24,11:02:52,Deposit,1935.55,Car party dark opportunity certain share deal let.
253,1009,2022-08-12,20:10:04,Withdrawal,9192.17,Small among possible method will many.
254,542,2023-01-01,07:51:51,Deposit,8120.34,Improve mean could.
255,2312,2022-10-17,22:16:23,Transfer,7406.79,Catch hard bring kid.
256,945,2021-09-13,11:00:34,Deposit,1271.99,Four himself person drop here themselves.
257,1104,2021-10-09,15:42:33,Withdrawal,913.75,Interesting wide response movement kid information these.
258,236,2023-10-17,23:19:39,Withdrawal,7802.96,Card style yeah various.
259,1609,2023-06-05,14:53:11,Withdrawal,9077.66,Third black recent others.
260,549,2023-04-11,11:13:37,Deposit,1187.86,Huge body him hospital.
261,2034,2025-03-02,21:15:02,Withdrawal,1988.9,Party senior decision authority young stop.
262,1266,2021-09-17,17:09:30,Transfer,3723.24,Range mind across collection defense picture foot.
263,61,2021-12-31,21:45:57,Withdrawal,1830.7,Per floor street face green south food.
264,1099,2022-09-06,00:42:58,Transfer,938.14,Those over talk wear want similar teacher.
265,1836,2023-10-02,06:28:26,Withdrawal,6225.12,Fill often nature.
266,2401,2024-11-03,19:52:55,Deposit,1816.31,Whether official eye policy name three should.
267,939,2020-06-20,20:39:26,Deposit,4821.36,Certainly hold series.
268,1642,2020-10-03,09:36:41,Deposit,9442.1,Other any quickly car wish money.
269,1123,2020-08-13,00:18:46,Withdrawal,3191.83,Somebody market material.
270,2084,2020-11-22,08:39:05,Transfer,9178.92,These form after wide determine dark hold.
271,422,2024-05-31,09:47:20,Deposit,7015.18,Generation nor official government.
272,1744,2025-01-22,22:33:29,Deposit,4491.2,Relate certain study large.
273,109,2021-05-05,09:06:23,Deposit,5715.11,Century detail eat reflect mind.
274,2184,2025-03-24,21:57:47,Withdrawal,3160.9,Side sister ready fight bad.
275,251,2021-12-05,02:41:54,Deposit,1670.49,Concern best public born season.
276,1450,2023-03-27,10:45:10,Transfer,2310.41,Financial turn sell address quality.
277,41,2023-12-05,07:03:02,Withdrawal,949.93,Adult reality home move.
278,572,2020-06-27,06:10:34,Deposit,5823.05,East lot question suffer.
279,974,2024-08-16,08:09:26,Transfer,8414.75,Wait plant friend.
280,1809,2021-04-09,17:29:52,Withdrawal,9174.08,Plant small action couple management.
281,573,2020-12-11,20:02:06,Withdrawal,4666.72,During concern push.
282,1534,2022-12-30,16:05:08,Transfer,7415.08,Field after citizen knowledge garden.
283,629,2024-01-27,03:44:22,Deposit,5022.17,Tonight series customer attorney front.
284,1042,2020-09-26,09:18:22,Transfer,7980.97,Outside economy bar city.
285,2211,2024-02-27,21:58:18,Deposit,5911.1,Into just himself human particular speak.
286,31,2024-09-22,22:06:49,Withdrawal,7718.89,Him deal your alone executive.
287,170,2021-04-06,06:37:58,Withdrawal,4932.17,Stuff course this together process ability modern.
288,2354,2020-09-28,07:14:19,Deposit,9616.81,Herself up light white six.
289,697,2021-11-07,08:07:38,Transfer,5899.78,Three can son left sister.
290,1452,2021-03-20,12:34:24,Deposit,3586.1,Exactly free agreement special safe down.
291,235,2022-09-17,01:28:42,Deposit,3409.53,Person strong it phone figure.
292,1188,2024-04-08,11:53:00,Withdrawal,2756.62,Defense chance man eight third require clearly.
293,1367,2021-11-13,10:12:03,Transfer,5039.53,East catch way unit.
294,2160,2021-01-26,13:34:37,Transfer,1929.13,Rate population identify group open treat.
295,704,2024-04-08,17:40:47,Withdrawal,6997.71,Agree hand reduce pay program collection.
296,1958,2021-03-03,22:07:27,Deposit,4051.26,Believe everybody develop service push audience share night.
297,2081,2020-11-10,06:03:19,Withdrawal,3985.01,Ten college outside establish job feel.
298,2395,2022-12-26,22:01:49,Deposit,3630.5,Chair board chair quality fire.
299,1307,2021-10-11,20:38:53,Transfer,3738.59,That area identify east.
300,1605,2020-09-09,12:27:55,Deposit,5558.94,Figure tonight throw will.
301,1436,2020-07-18,16:18:17,Deposit,7552.27,Author design reflect series decide.
302,1445,2022-11-16,07:20:47,Transfer,7960.19,Here return site manage road treat.
303,1662,2022-01-14,00:22:33,Deposit,7571.76,Thus collection member site.
304,1832,2021-01-27,13:38:44,Deposit,5529.18,Project policy side whose black senior measure.
305,1032,2024-02-02,23:01:00,Deposit,6464.73,Evidence research partner stuff.
306,695,2024-05-21,09:58:23,Deposit,2464.38,Note such probably story measure old realize also.
307,1178,2025-02-24,19:29:22,Transfer,5738.24,Suggest get white rich.
308,56,2022-12-18,02:11:52,Transfer,7024.63,International street could food miss hotel which.
309,698,2024-11-20,16:46:10,Transfer,4439.41,Her civil least.
310,1633,2023-10-02,00:43:40,Deposit,2630.14,Past pick series six movement information.
311,1404,2023-02-26,00:02:49,Deposit,9629.1,Agent enjoy great can.
312,796,2020-09-06,12:07:13,Deposit,676.87,May they federal short account inside ok.
313,162,2021-08-21,00:21:17,Deposit,7174.59,Professional cover by yeah.
314,205,2023-11-11,14:23:42,Transfer,7604.98,Purpose authority speech music former.
315,1007,2023-10-02,21:44:35,Withdrawal,7632.53,Visit foreign television half.
316,728,2021-01-13,11:38:50,Deposit,1611.62,Word find nation not indeed remain government owner.
317,384,2023-07-22,16:40:37,Deposit,9496.88,Stage answer sure arm still.
318,24,2021-03-16,09:01:30,Transfer,477.3,Run politics shake.
319,2167,2020-07-26,20:54:18,Deposit,4619.42,Message official notice political deep policy president.
