transaction_id,account_id,transaction_date,transaction_time,transaction_type,amount,description
2184,1160,2023-01-01,03:39:21,Transfer,4810.06,Cut hot way major spend issue popular.
2185,424,2020-12-15,00:27:53,Deposit,2633.59,Leader around nation it order happen always.
2186,1536,2023-07-17,17:05:15,Withdrawal,3376.78,Certainly have rich.
2187,237,2021-03-02,00:15:06,Withdrawal,2964.92,Likely body edge.
2188,2078,2021-09-05,04:10:18,Transfer,7202.01,Fish each sea.
2189,2401,2021-03-10,00:41:18,Transfer,8430.88,Beyond doctor end treatment opportunity make.
2190,2032,2025-05-28,01:54:41,Withdrawal,6314.66,Skin particularly around threat.
2191,2089,2020-10-26,16:07:43,Withdrawal,1359.7,My he provide way yourself participant which.
2192,1605,2021-03-10,23:51:59,Deposit,141.76,Company open put brother team its strong onto.
2193,1156,2024-02-09,00:54:28,Deposit,5266.26,Visit dinner most dog.
2194,244,2024-08-20,09:31:05,Deposit,308.79,Chance ever skill return budget prepare.
2195,916,2020-11-25,20:01:42,Withdrawal,1582.31,In front down wonder this then series.
2196,926,2020-07-27,20:29:13,Deposit,4922.27,Move image weight benefit whether effort rate.
2197,1139,2024-02-15,00:37:38,Deposit,4382.45,Discuss where let.
2198,1691,2020-09-30,23:44:17,Withdrawal,9903.79,House course wall public.
2199,1588,2022-11-12,04:04:57,Deposit,5124.73,Career wife amount language.
2200,798,2024-05-07,18:36:16,Withdrawal,1006.76,Behavior natural off drug.
2201,1547,2025-01-30,23:40:50,Deposit,1461.27,Season five director avoid medical.
2202,1341,2022-08-17,01:29:19,Transfer,4048.16,
2203,522,2024-03-24,03:15:28,Deposit,383.18,At only gun force billion back.
2204,1176,2022-12-22,08:31:16,Deposit,3729.08,Them experience Mr.
2205,1850,2024-05-04,19:07:58,Deposit,1852.68,Identify cut reason room she by his able.
2206,1512,2022-01-04,01:47:31,Transfer,5642.98,Begin car increase gas already people trouble price.
2207,1075,2023-11-14,20:33:10,Deposit,9231.05,Above operation dark nice.
2208,680,2020-12-13,11:31:37,Transfer,8826.79,Course police decision off book.
2209,285,2024-07-04,00:11:50,Withdrawal,4031.44,Certain item wind may.
2210,2222,2021-03-07,05:25:48,Deposit,8499.51,Simply sense sense voice hit push program.
2211,521,2024-11-25,00:28:12,Withdrawal,5276.77,Game still than parent worker arrive thousand peace.
2212,1129,2023-09-17,17:35:07,Withdrawal,6352.51,Card miss man senior suffer control manage.
2213,2281,2022-04-24,15:04:00,Withdrawal,7998.58,Quite sea spend foreign.
2214,1337,2025-01-15,06:17:26,Deposit,4741.62,Everything contain technology bring civil.
2215,2260,2025-02-08,22:22:41,Withdrawal,3034.43,Mrs security collection behind.
2216,593,2023-06-08,13:06:40,Deposit,7994.45,Analysis produce TV executive eat concern child.
2217,2275,2023-07-05,16:35:50,Deposit,2518.11,Court treatment everybody remain science.
2218,1610,2022-01-08,02:56:51,Deposit,7244.63,Writer method prepare body.
2219,1891,2020-09-01,07:32:43,Deposit,4625.62,Stuff on realize.
2220,171,2022-10-03,15:49:38,Deposit,9430.79,Season reach bar.
2221,451,2024-05-20,04:03:19,Transfer,325.35,Usually without I each between.
2222,1560,2020-10-30,04:10:18,Transfer,5875.73,Message as special design pick.
2223,1080,2023-07-14,04:11:55,Deposit,6046.78,Threat or author explain provide threat feeling.
2224,2351,2021-04-09,06:00:20,Withdrawal,73.95,Happen improve soldier new although.
2225,1081,2024-11-19,13:07:33,Withdrawal,9307.49,Responsibility bed specific across.
2226,2054,2023-10-30,17:05:47,Transfer,8334.79,Along industry your company population.
2227,418,2025-06-15,08:38:28,Transfer,8044.33,Help chance travel direction.
2228,1292,2023-10-03,11:59:39,Withdrawal,9564.57,Shoulder hand order kind wall understand cut.
2229,586,2024-12-21,01:50:23,Withdrawal,7265.55,First laugh nor ahead plant film hear.
2230,2262,2021-10-16,06:10:18,Transfer,7772.86,Sit structure realize.
2231,186,2023-02-14,22:49:39,Deposit,2625.72,Black direction notice.
2232,812,2020-11-20,12:31:37,Deposit,5161.53,Send relate southern pass.
2233,2304,2022-11-04,06:25:18,Transfer,1044.65,
2234,1401,2023-06-23,14:22:09,Deposit,6977.1,Travel we cause tend ten send he.
2235,1290,2021-05-04,18:54:06,Transfer,1167.28,Music stage red my gas any imagine.
2236,10,2023-08-18,21:49:17,Withdrawal,3125.07,Garden strategy represent term agency.
2237,1480,2021-04-16,18:11:32,Withdrawal,23.62,Can politics woman necessary action movie.
2238,196,2021-10-15,03:55:10,Withdrawal,4537.82,Low film man administration.
2239,2062,2024-07-20,02:03:27,Withdrawal,5270.41,Property forward catch parent peace produce positive often.
2240,811,2023-11-08,06:17:59,Deposit,2634.13,Building ahead large notice bar individual quickly.
2241,1597,2024-05-30,08:30:14,Withdrawal,3153.88,Give unit girl serious.
2242,625,2024-01-05,16:13:39,Withdrawal,3287.94,Father play yes stay window kitchen.
2243,2457,2023-04-15,20:58:32,Withdrawal,7907.69,Everybody finish let.
2244,1097,2023-05-24,20:28:55,Deposit,2232.62,Message trouble race as wait stock during carry.
2245,1843,2023-01-06,18:29:37,Withdrawal,2590.13,Woman five where upon woman.
2246,2152,2021-03-23,16:25:49,Withdrawal,47.06,Total employee mention practice.
2247,1012,2021-04-23,14:45:21,Transfer,1074.36,Inside site morning community.
2248,1184,2020-09-01,05:41:16,Deposit,1866.36,Program according really nor rule cover.
2249,1231,2021-01-02,11:16:39,Deposit,53.03,Should husband with deal piece challenge important.
2250,919,2020-11-07,18:25:28,Deposit,4272.01,Kitchen hour southern perform without including Mr.
2251,1437,2022-05-05,06:52:36,Deposit,9403.63,Yourself the bring candidate always material find.
2252,2280,2021-12-13,15:44:50,Deposit,3483.35,Old study four right amount property yourself eat.
2253,1625,2020-08-21,22:37:49,Deposit,885.02,Lead total new first even cell.
2254,333,2020-08-14,02:33:34,Deposit,9964.54,Green south law fall mission hope.
2255,1362,2021-12-27,20:08:12,Withdrawal,4075.97,Throw little meet behavior story produce.
2256,1320,2023-10-05,03:24:57,Deposit,3967.69,Range just take.
2257,1183,2022-07-12,07:40:20,Deposit,623.71,He successful man left theory environment use.
2258,2135,2020-06-19,00:25:09,Withdrawal,4644.15,Close start model beat own by.
2259,2300,2021-09-17,08:19:29,Withdrawal,7751.23,Help long meeting.
2260,2126,2024-03-03,07:59:23,Transfer,2723.52,Model standard film stand.
2261,285,2024-05-19,10:21:00,Withdrawal,131.05,Media amount collection much memory other.
2262,1661,2023-03-30,16:33:49,Deposit,263.28,Modern thousand reality really business paper eye.
2263,1868,2021-07-06,17:32:22,Withdrawal,49.25,Line little color notice leg compare.
2264,1992,2025-01-02,00:02:15,Deposit,6541.88,Growth into share forward.
2265,1270,2023-04-27,12:54:54,Transfer,1980.73,Issue guess onto director environmental.
2266,152,2020-12-10,08:16:59,Withdrawal,5282.77,Whose director bill office success black positive guy.
2267,303,2022-07-29,07:33:27,Withdrawal,1075.1,Professor return herself somebody enjoy decade.
2268,1734,2022-06-05,04:14:03,Deposit,9927.08,No interesting board billion expect hair bar.
2269,97,2024-02-01,11:26:12,Deposit,9219.92,Seat project her trial listen strategy since.
2270,1204,2023-07-24,03:24:27,Deposit,9448.68,Feel staff animal lead.
2271,1369,2023-06-11,23:14:32,Transfer,4234.51,Blue some pressure sit trial discover.
2272,952,2024-06-17,09:55:01,Deposit,6659.18,Hair three write father tell much group argue.
2273,2313,2024-02-10,10:12:33,Transfer,4077.5,Account material single represent mind.
2274,1403,2022-06-27,14:15:06,Withdrawal,9401.83,Discussion everybody human follow into nation.
2275,447,2024-06-27,22:36:52,Withdrawal,7763.79,Factor all pick network painting.
2276,865,2022-07-27,12:27:00,Transfer,2349.04,Author woman listen kind like.
2277,6,2022-05-29,16:05:21,Deposit,3118.06,Star she beautiful at media.
2278,2399,2023-10-04,23:21:59,Transfer,1809.32,Issue analysis home cold.
2279,1426,2021-02-23,09:34:42,Deposit,7196.22,Kid information street popular matter similar garden market.
2280,1957,2022-12-31,03:46:34,Transfer,8316.4,General positive mouth.
2281,1862,2020-07-15,05:48:07,Deposit,9615.67,More charge vote ready.
2282,1752,2022-01-13,04:31:00,Transfer,9131.26,Business owner social strategy.
2283,2029,2025-03-16,16:22:24,Transfer,7230.52,Seek parent old.
2284,804,2023-01-29,05:14:30,Transfer,8119.76,Change impact point including region.
2285,2155,2023-06-06,18:19:12,Withdrawal,8579.65,Fund play enter almost long.
2286,998,2022-12-16,06:25:24,Transfer,1542.8,Popular suggest center address.
2287,1590,2020-12-28,23:06:19,Transfer,4537.82,Poor force candidate line including energy race eat.
2288,321,2025-04-16,11:46:21,Deposit,2742.06,Half up type meeting.
2289,510,2022-03-07,17:06:07,Withdrawal,9174.94,Always six law speech fill be instead.
2290,137,2024-01-24,08:56:16,Withdrawal,68.58,Expert for nor fill.
2291,415,2024-11-09,05:56:17,Withdrawal,8728.41,Wind especially position international send occur development white.
2292,1895,2021-04-17,11:34:16,Transfer,1261.7,Heart worry public PM movement short.
2293,498,2022-08-28,22:13:32,Withdrawal,1371.11,Wait foreign ahead beat.
2294,2407,2022-12-21,22:36:25,Transfer,6127.43,Add example administration behind without political leader.
2295,1520,2025-06-11,10:06:24,Withdrawal,3937.52,Pm money inside back.
2296,2428,2021-06-23,04:22:13,Transfer,6942.68,Middle particularly forget along information best beat.
2297,417,2023-08-10,02:49:45,Withdrawal,6629.59,Watch girl economic sell the.
2298,1343,2022-06-23,15:14:38,Withdrawal,4865.12,Party choice strategy.
2299,946,2023-10-05,16:16:09,Transfer,7176.3,Stock only food process where about yeah room.
2300,542,2025-05-30,21:31:16,Withdrawal,6959.15,Paper pressure million stage population someone tax.
2301,2216,2025-05-21,23:34:03,Withdrawal,3981.35,Country activity dog recent long long.
2302,619,2023-05-05,03:18:24,Withdrawal,3228.32,Treat director night place friend few only.
2303,225,2021-02-16,09:29:38,Withdrawal,248.3,Soon different nation individual.
2304,1596,2022-04-28,13:00:51,Deposit,80.81,Election people magazine language tell.
2305,456,2022-12-06,15:19:29,Transfer,7709.47,Mouth television choose positive even.
2306,1339,2025-04-08,02:00:33,Withdrawal,747.26,Almost maybe really fly tree write figure.
2307,2398,2022-04-08,05:17:38,Withdrawal,1933.34,Into more nice kid.
2308,1034,2025-05-25,00:04:01,Transfer,6238.63,Heavy these letter never attention study business.
2309,571,2022-06-04,11:08:54,Deposit,8555.6,
2310,2278,2023-01-26,16:59:47,Transfer,1407.92,Spend ok person data phone heavy purpose enter.
2311,2175,2024-09-30,11:53:05,Withdrawal,6663.43,Difference skin president change.
2312,2347,2023-04-11,19:17:09,Transfer,521.83,Explain position onto available start election head.
2313,2297,2023-07-13,00:12:29,Withdrawal,4785.93,Development mother impact nation ahead any learn.
2314,894,2023-02-14,01:45:07,Deposit,623.0,Four fall staff will.
2315,2168,2024-03-13,22:39:57,Deposit,4942.96,Special affect although serve.
2316,1910,2020-06-20,12:22:53,Transfer,2457.67,Game card probably foot better.
2317,1487,2021-12-05,13:33:00,Withdrawal,7249.15,Develop evidence fill subject manage single.
2318,568,2024-10-01,09:29:46,Deposit,9878.38,Tree worry response among challenge measure.
2319,2173,2023-08-07,04:04:44,Transfer,1370.76,Run contain mean fast identify beyond.
2320,1683,2021-11-19,17:35:45,Deposit,7509.02,Base now decide.
2321,1629,2025-03-15,04:44:15,Withdrawal,1224.43,Box purpose rate early.
2322,915,2020-06-23,23:36:41,Deposit,1563.85,Here support worry seem event economy manage explain.
2323,477,2022-07-10,14:26:05,Transfer,6281.64,Cover upon candidate impact compare woman network.
2324,1735,2024-05-27,13:35:28,Transfer,1900.85,Expect from member guy number task sister.
2325,2497,2024-09-25,11:26:55,Transfer,670.51,Western early within face that.
2326,1780,2020-11-26,16:22:31,Withdrawal,159.36,Admit experience spring story good nice.
2327,923,2022-04-02,05:45:43,Transfer,6667.59,Girl cultural street specific health.
2328,935,2021-12-27,04:20:33,Transfer,1805.05,Treat nothing gas trouble reveal position.
2329,2186,2024-01-31,06:06:04,Deposit,8856.26,He hand eight mission name carry represent.
2330,1648,2024-10-10,09:41:54,Withdrawal,9115.98,Area attack design.
2331,2468,2021-03-17,09:36:10,Deposit,4616.34,Official six decade use only measure know respond.
2332,2326,2022-12-03,04:25:02,Withdrawal,8458.14,Upon weight chair inside.
2333,764,2020-06-25,05:15:22,Withdrawal,1858.24,Industry account language recently fact possible camera.
2334,1054,2020-06-27,17:10:37,Withdrawal,3019.83,Management bill voice.
2335,1018,2023-08-12,04:06:52,Transfer,6301.64,Partner result training because natural on first.
2336,2221,2021-03-19,05:49:52,Withdrawal,5077.88,Same will able especially current away.
2337,476,2021-04-27,22:42:31,Deposit,3098.01,Help cell sing establish.
2338,905,2024-10-27,04:58:03,Deposit,4266.6,House relationship figure respond garden.
2339,2129,2023-07-19,10:09:58,Deposit,3211.54,Prevent notice discussion campaign everybody cell.
2340,349,2023-03-04,09:45:03,Withdrawal,3179.47,Watch hair seem.
2341,229,2020-12-29,01:11:18,Transfer,9099.36,Fill number enter reality structure team.
2342,684,2020-07-13,21:54:02,Withdrawal,5311.16,Institution what he eight color.
2343,214,2023-01-05,14:08:06,Deposit,9223.72,Work set no pressure.
2344,623,2021-10-05,14:00:35,Deposit,7135.26,Color lose science.
2345,1599,2022-12-03,16:44:03,Deposit,4684.94,Agency follow order reality the never protect.
2346,732,2022-02-21,05:05:03,Transfer,9666.59,Clear between nearly lawyer ten be.
2347,93,2024-04-05,19:50:47,Deposit,1466.08,Yeah clear million war interesting.
2348,1217,2023-05-21,20:07:34,Deposit,5356.52,
2349,1309,2023-07-25,20:34:31,Withdrawal,6582.36,Baby story often near standard traditional people.
2350,2006,2021-05-14,03:07:49,Withdrawal,7697.92,Citizen enter hundred movie player news.
2351,2340,2023-07-02,11:15:20,Deposit,6020.43,Prove big since theory.
2352,2003,2022-07-18,19:29:04,Transfer,3165.31,Institution door media must according myself.
2353,2312,2020-06-29,17:05:32,Transfer,8163.08,Common machine while summer.
2354,1850,2022-10-27,21:55:45,Withdrawal,6825.07,American senior become.
2355,1964,2024-02-28,04:37:14,Transfer,2173.55,Wait build say assume safe.
2356,1868,2024-10-17,17:05:53,Deposit,2192.0,Have lead parent thing technology rate there.
2357,608,2022-05-14,02:46:47,Withdrawal,3935.52,Thing economic bit experience.
2358,1766,2023-11-30,13:35:40,Deposit,1043.07,Wonder everybody enough beautiful forward blood box floor.
2359,2276,2025-05-05,23:02:24,Withdrawal,7305.53,Lay dark account could.
2360,852,2021-04-18,08:31:09,Deposit,7966.86,Couple talk there according.
2361,1481,2025-04-04,15:55:31,Withdrawal,9562.84,Pm safe research time.
2362,2082,2024-07-23,14:22:21,Transfer,1470.07,Reduce professor peace majority thing local.
2363,1036,2021-10-16,21:07:03,Transfer,5590.61,Him eye throughout bad home concern.
2364,915,2025-04-03,19:39:14,Deposit,7995.72,Where growth lawyer seem cause.
2365,1933,2020-09-21,04:44:05,Transfer,7164.01,Series create choice offer woman investment hot movement.
2366,341,2025-03-29,18:44:08,Deposit,6370.4,Prove admit figure unit send animal wrong.
2367,1749,2024-09-08,00:32:34,Withdrawal,7627.34,However everybody if write live.
2368,1430,2021-01-13,07:34:53,Deposit,1847.08,Situation growth cause material couple time staff financial.
2369,27,2022-02-17,07:11:14,Deposit,6175.66,Line new range budget common.
2370,2255,2020-07-21,18:54:42,Withdrawal,1385.89,Mouth not per front treat.
2371,285,2022-01-21,13:01:49,Withdrawal,6821.97,Rest sense language born wait range tonight.
2372,1761,2023-03-16,18:13:35,Deposit,6296.01,Exist else admit skin.
2373,644,2021-12-24,09:31:58,Transfer,7316.38,But enjoy member poor role.
2374,1360,2021-06-02,12:46:36,Deposit,6847.47,Statement major campaign quite measure.
2375,1489,2021-05-02,15:16:20,Deposit,333.29,Here feel three my sound want learn continue.
2376,1244,2022-08-27,12:13:41,Transfer,5382.28,Medical only participant environment entire model.
2377,528,2023-03-08,01:14:20,Deposit,4298.45,Modern term activity after man.
2378,196,2024-12-05,21:43:07,Deposit,2105.94,Would without environmental meet camera Democrat stock.
2379,1851,2020-11-26,14:27:55,Deposit,1298.73,Consumer despite minute check throw style suffer.
2380,629,2024-08-29,04:55:54,Transfer,6545.4,Require hundred many at.
2381,780,2021-11-20,11:59:14,Transfer,2724.45,Toward away growth make rich well forget.
2382,1125,2023-11-30,11:33:23,Deposit,9957.69,Know side pretty amount hotel speech money exactly.
2383,839,2023-12-09,04:17:53,Transfer,1156.13,Civil once pressure why.
2384,2348,2023-12-18,19:08:23,Deposit,8495.71,Only kid live way.
2385,2483,2022-03-24,22:51:50,Deposit,8713.29,Realize agreement happy.
2386,906,2023-01-31,18:19:12,Deposit,4226.05,Focus organization nature wait.
2387,1747,2024-08-02,21:34:01,Transfer,3861.21,Chance standard law toward movie decade raise.
2388,1252,2022-02-03,21:19:48,Deposit,2494.81,Your thought pretty provide.
2389,1042,2020-08-12,16:09:21,Withdrawal,2791.7,Trade beautiful relationship dream.
2390,78,2021-10-10,05:10:32,Withdrawal,1004.91,Western reduce true take help continue me.
2391,2377,2022-12-01,13:49:58,Withdrawal,52.8,With win teacher order station.
2392,1178,2020-12-16,16:42:31,Withdrawal,7889.9,Store image as economic write news rather.
2393,113,2023-08-08,07:50:41,Deposit,3298.69,Billion myself think wrong.
2394,2007,2023-12-05,05:49:50,Withdrawal,3000.24,Notice give popular president.
2395,1692,2020-07-15,20:09:10,Transfer,1707.86,
2396,531,2023-12-01,08:55:09,Withdrawal,967.97,Moment social catch push result thus none run.
2397,1302,2025-04-07,09:12:06,Deposit,6545.43,Its concern again attention lead example.
2398,1671,2021-10-23,08:10:44,Transfer,5735.73,Result under author kind property.
2399,405,2023-09-04,10:15:46,Transfer,7191.19,Sell fund raise company really.
2400,1352,2020-07-17,02:07:59,Deposit,7086.4,Management push simple against or.
2401,1002,2022-09-12,11:03:44,Transfer,1634.82,Summer evidence member.
2402,2264,2024-12-21,06:15:39,Deposit,3250.53,Between natural degree statement good.
2403,791,2024-06-07,03:22:56,Withdrawal,6482.74,Listen tell as.
2404,963,2020-08-13,11:49:21,Withdrawal,9213.13,Remember development everybody usually life.
2405,1254,2021-12-06,11:40:02,Withdrawal,9950.63,Now happy rather past prevent guess traditional.
2406,1393,2024-05-27,09:24:13,Transfer,8704.96,When order important camera yet movie information.
2407,1492,2022-07-17,06:01:15,Deposit,7718.17,Draw move entire shoulder clear.
2408,1351,2023-07-03,10:12:33,Deposit,8172.54,She consumer population upon them writer occur.
2409,1784,2020-10-24,06:53:35,Deposit,4635.44,Resource hundred thought guy leg man.
2410,2262,2021-10-25,11:11:46,Transfer,1779.91,Decide range hotel industry just.
2411,338,2024-12-06,21:35:26,Withdrawal,2770.84,Plan training sometimes account drive.
2412,975,2020-08-15,08:13:55,Deposit,2554.72,Measure receive reflect structure fly care.
2413,2186,2023-11-30,10:05:12,Transfer,79.86,Person hotel east.
2414,1929,2024-04-29,01:14:21,Deposit,8369.33,Gas part site dark true recent political.
2415,1268,2022-06-10,10:03:00,Deposit,1789.13,Open white part write.
2416,902,2023-04-27,00:46:16,Withdrawal,9573.21,Too dog why despite easy ok marriage.
2417,1209,2021-12-09,02:39:23,Transfer,7311.07,Determine also brother difference sport resource.
2418,742,2024-06-06,04:20:39,Deposit,3266.59,How party successful thank.
2419,2309,2020-11-11,02:31:55,Withdrawal,4435.12,Near sort at they.
2420,2456,2025-06-09,08:59:17,Transfer,9825.72,Environment because form true high.
2421,772,2021-11-10,17:12:33,Withdrawal,9894.5,Will specific capital view.
2422,916,2024-03-23,00:07:57,Deposit,7089.33,Top condition left seven use as keep.
2423,1916,2023-05-17,00:21:08,Withdrawal,9715.94,News industry kid several enough.
2424,1025,2022-05-06,20:42:07,Withdrawal,7672.87,Usually off discuss heart word.
2425,360,2023-02-20,06:57:29,Withdrawal,15.62,Third message wind.
2426,1461,2020-07-27,12:17:34,Transfer,5708.7,Happy understand new commercial.
2427,160,2021-05-27,18:47:39,Deposit,8783.16,Cold for economic.
2428,688,2022-09-09,23:01:40,Deposit,1171.69,Surface window boy ability.
2429,1553,2021-12-11,20:24:12,Transfer,5221.66,Difference care in place.
2430,249,2025-05-03,09:23:08,Deposit,9154.98,Try themselves particularly country.
2431,1879,2020-06-22,02:40:36,Withdrawal,6810.78,Room the unit use each chance cultural win.
2432,2080,2020-11-25,14:39:17,Transfer,5781.89,Special color receive clear.
2433,931,2021-08-30,03:02:57,Deposit,6871.72,American style candidate.
2434,1151,2021-04-04,10:33:15,Withdrawal,9026.01,Score if against especially talk.
2435,1010,2024-10-24,08:26:31,Transfer,8372.64,Economy real participant player.
2436,1963,2021-11-25,22:04:00,Transfer,8839.73,Ten company husband.
2437,519,2025-05-28,01:25:23,Withdrawal,1060.27,Today another wide cost student.
2438,1345,2021-11-26,16:48:22,Transfer,3945.53,Return you car necessary star peace.
2439,903,2021-10-30,03:07:45,Deposit,5213.5,Degree moment recently majority first kitchen.
2440,2216,2020-11-26,20:26:34,Transfer,6769.49,His entire party trial.
2441,597,2025-01-08,12:41:41,Transfer,3661.3,Fall central act smile forward performance.
2442,2298,2022-05-21,17:02:20,Transfer,5125.9,Write million set mother.
2443,430,2021-12-18,22:12:10,Transfer,7731.95,Anyone piece first sign similar front down provide.
2444,962,2023-04-04,01:16:53,Transfer,4679.44,Describe think do high.
2445,210,2021-01-26,15:12:15,Transfer,9094.58,Structure consider allow product.
2446,17,2025-02-26,09:46:23,Withdrawal,2379.75,Protect design security wind player past four sign.
2447,2386,2022-08-08,06:23:40,Transfer,8498.04,Exactly prevent arrive coach.
2448,1218,2024-08-22,12:22:24,Withdrawal,3133.2,Possible member water population should right eat.
2449,1035,2025-02-14,21:40:12,Withdrawal,2778.27,Reduce direction social spend full response agency.
2450,178,2021-11-30,00:30:43,Withdrawal,4035.89,Religious there thank.
2451,698,2024-05-03,13:12:19,Transfer,4266.17,Somebody one bill local what ability finish.
2452,1407,2020-09-14,15:39:05,Withdrawal,6545.38,Lot plan side writer.
2453,1852,2024-11-16,22:17:21,Withdrawal,9935.21,Approach prove design activity.
2454,1602,2021-03-21,15:44:58,Deposit,9367.46,Next anything wear stand.
2455,1022,2021-11-21,15:59:29,Withdrawal,5801.59,Culture where such.
2456,858,2024-12-19,18:51:54,Transfer,5162.09,Black boy face let oil civil happen.
2457,2326,2020-12-05,21:36:52,Transfer,551.36,Their toward computer example.
2458,2345,2021-08-24,05:36:13,Withdrawal,3645.1,Two to happy develop lot now.
2459,1846,2025-05-27,11:33:53,Transfer,7565.72,Production city war turn season anything.
2460,2036,2025-02-16,02:53:03,Withdrawal,4172.23,Watch remember dinner artist hear.
2461,2262,2024-12-19,04:19:32,Deposit,3790.38,Find so if consider such young.
2462,894,2023-10-17,13:45:01,Withdrawal,6775.13,Fine consider eight environment.
2463,863,2022-01-08,19:51:27,Deposit,9960.83,Age blood factor site better always attack political.
2464,401,2024-03-19,01:27:02,Transfer,8403.57,Scene learn and.
2465,1589,2022-07-15,17:53:31,Deposit,8802.81,Event we town pattern.
2466,792,2023-06-04,03:44:59,Withdrawal,6579.31,Relate actually entire company determine glass exist.
2467,11,2023-06-28,17:46:53,Withdrawal,5083.53,Serve window but dog star well rate.
2468,2392,2024-10-31,16:31:51,Deposit,1494.64,Base evidence safe drop save offer.
2469,2053,2023-03-26,08:27:26,Withdrawal,2832.39,Oil president player notice responsibility probably friend.
2470,775,2024-08-31,20:57:22,Withdrawal,5820.61,Respond hit few strong miss bill camera.
2471,533,2025-03-08,13:52:57,Transfer,3336.98,Boy relate talk central doctor factor.
2472,768,2021-06-20,17:31:39,Deposit,879.11,Leg win person reflect.
2473,567,2025-05-05,00:56:25,Transfer,8013.62,Director or theory entire under agreement rock.
2474,650,2022-09-27,14:53:03,Withdrawal,2386.55,History rather beautiful consider again team technology hospital.
2475,1356,2021-08-22,17:31:33,Deposit,2854.59,Stuff believe amount up simple father line.
2476,1076,2020-10-13,12:26:42,Transfer,6902.82,Wide over study wife none range church.
2477,525,2023-12-23,20:41:33,Deposit,2685.7,Design cup research poor need.
2478,1197,2024-11-20,15:32:40,Withdrawal,7924.18,Star similar fly someone memory fill.
2479,137,2023-11-06,09:26:16,Transfer,2437.83,Green great rich think.
2480,1508,2020-09-16,23:18:33,Withdrawal,6951.66,Six determine section sort.
2481,172,2021-01-04,07:14:19,Deposit,377.11,Available green can few media.
2482,1927,2024-07-28,00:33:48,Withdrawal,745.69,Late doctor specific as.
2483,1267,2022-01-14,13:03:59,Withdrawal,9370.81,Can tough wait similar through bit.
2484,2309,2023-07-20,03:41:24,Withdrawal,7995.21,Into happen control turn.
2485,456,2024-01-26,22:31:54,Deposit,1086.66,Able bring rather worker role wife.
2486,2446,2021-05-02,20:54:39,Deposit,9565.95,A boy adult fear front city.
2487,59,2023-01-18,16:20:37,Withdrawal,3256.03,Visit identify population support scene size form.
2488,1660,2024-12-20,12:17:40,Deposit,9062.21,Book any plan sit try television.
2489,613,2022-02-11,18:12:08,Transfer,6494.58,Rather get long art five Mr.
2490,109,2020-12-22,07:06:10,Withdrawal,3868.17,Left day book training one police training want.
2491,2284,2024-05-03,06:33:38,Transfer,3533.48,Article industry history.
2492,1052,2024-02-16,19:06:22,Withdrawal,3703.47,Decide new security people newspaper seven.
2493,1394,2025-06-05,01:02:47,Transfer,3336.34,Investment whole article occur tend well.
2494,1671,2025-04-17,03:37:49,Deposit,7059.87,Form send entire listen.
2495,2047,2023-02-16,19:43:00,Withdrawal,4878.01,Part big source bit.
2496,1277,2022-02-19,10:10:59,Deposit,2328.55,Eight similar shake high determine worry.
2497,1680,2022-07-27,23:30:20,Deposit,5769.82,Final go power.
